No.,Time,Source,Destination,Protocol,Length,Info
1,0,fe80::3cd1:15ce:a5c7:3d56,ff02::1:2,DHCPv6,172,Solicit XID: 0x607515 CID: 000100011b8f9d1d28802302c90f 
2,0.41234,fe80::5034:59dc:7b1d:2e8c,ff02::c,SSDP,208,M-SEARCH * HTTP/1.1 
3,0.903527,fe80::423:3956:e3c5:5411,fe80::5034:59dc:7b1d:2e8c,SSDP,453,HTTP/1.1 200 OK 
4,1.372833,fe80::5034:59dc:7b1d:2e8c,fe80::423:3956:e3c5:5411,pnrp,248,PNRP LOOKUP Message 
5,1.373452,fe80::423:3956:e3c5:5411,fe80::5034:59dc:7b1d:2e8c,pnrp,96,PNRP AUTHORITY Message 
6,1.378044,fe80::5034:59dc:7b1d:2e8c,fe80::423:3956:e3c5:5411,pnrp,248,PNRP LOOKUP Message 
7,1.378405,fe80::423:3956:e3c5:5411,fe80::5034:59dc:7b1d:2e8c,pnrp,96,PNRP AUTHORITY Message 
8,1.378637,fe80::5034:59dc:7b1d:2e8c,fe80::423:3956:e3c5:5411,pnrp,248,PNRP LOOKUP Message 
9,1.378962,fe80::423:3956:e3c5:5411,fe80::5034:59dc:7b1d:2e8c,pnrp,96,PNRP AUTHORITY Message 
10,1.379195,fe80::5034:59dc:7b1d:2e8c,fe80::423:3956:e3c5:5411,pnrp,248,PNRP LOOKUP Message 
11,1.379516,fe80::423:3956:e3c5:5411,fe80::5034:59dc:7b1d:2e8c,pnrp,96,PNRP AUTHORITY Message 
12,1.62731,192.168.1.108,74.125.227.207,TLSv1.2,144,Application Data
13,1.627367,192.168.1.108,74.125.227.207,TLSv1.2,100,Application Data
14,1.627532,192.168.1.108,192.168.1.1,DNS,75,Standard query 0xa3a4  A ssl.gstatic.com
15,1.63936,192.168.1.1,192.168.1.108,DNS,91,Standard query response 0xa3a4  A 216.58.218.163
16,1.645819,74.125.227.207,192.168.1.108,TCP,60,443 > 49431 [ACK] Seq=1 Ack=91 Win=361 Len=0
17,1.646604,74.125.227.207,192.168.1.108,TCP,60,443 > 49431 [ACK] Seq=1 Ack=137 Win=361 Len=0
18,1.646933,74.125.227.207,192.168.1.108,TLSv1.2,100,Application Data
19,1.647001,192.168.1.108,216.58.218.163,QUIC,1392,"CID: 9680687472360579121, Seq: 1"
20,1.663597,74.125.227.207,192.168.1.108,TLSv1.2,149,Application Data
21,1.663598,74.125.227.207,192.168.1.108,TLSv1.2,135,Application Data
22,1.663648,192.168.1.108,74.125.227.207,TCP,54,49431 > 443 [ACK] Seq=137 Ack=223 Win=16389 Len=0
23,1.663699,74.125.227.207,192.168.1.108,TLSv1.2,100,Application Data
24,1.664295,192.168.1.108,74.125.227.207,TLSv1.2,100,Application Data
25,1.685799,216.58.218.163,192.168.1.108,QUIC,1392,"CID: 0, Seq: 1"
26,1.688492,192.168.1.108,216.58.218.163,QUIC,79,"CID: 9680687472360579121, Seq: 2"
27,1.718808,74.125.227.207,192.168.1.108,TCP,60,443 > 49431 [ACK] Seq=269 Ack=183 Win=361 Len=0
28,2.966943,192.168.1.181,192.168.1.108,TCP,74,34153 > 2869 [SYN] Seq=0 Win=14600 Len=0 MSS=1460 SACK_PERM=1 TSval=353568636 TSecr=0 WS=2
29,2.967167,192.168.1.108,192.168.1.181,TCP,74,"2869 > 34153 [SYN, ACK] Seq=0 Ack=1 Win=8192 Len=0 MSS=1460 WS=256 SACK_PERM=1 TSval=50642 TSecr=353568636"
30,2.96925,192.168.1.181,192.168.1.108,TCP,66,34153 > 2869 [ACK] Seq=1 Ack=1 Win=14600 Len=0 TSval=353568636 TSecr=50642
31,2.973322,192.168.1.181,192.168.1.108,TCP,1514,[TCP segment of a reassembled PDU]
32,3.008681,192.168.1.181,192.168.1.108,HTTP/XML,309,NOTIFY /upnp/eventing/edabcquqlg HTTP/1.1 
33,3.008764,192.168.1.108,192.168.1.181,TCP,66,2869 > 34153 [ACK] Seq=1 Ack=1692 Win=66560 Len=0 TSval=50646 TSecr=353568636
34,3.008962,192.168.1.108,192.168.1.181,HTTP,191,HTTP/1.1 200 OK 
35,3.011393,192.168.1.181,192.168.1.108,TCP,66,34153 > 2869 [ACK] Seq=1692 Ack=126 Win=14600 Len=0 TSval=353568640 TSecr=50646
36,3.011459,192.168.1.108,192.168.1.181,TCP,66,"2869 > 34153 [FIN, ACK] Seq=126 Ack=1692 Win=66560 Len=0 TSval=50646 TSecr=353568640"
37,3.04511,192.168.1.181,192.168.1.108,TCP,74,34154 > 2869 [SYN] Seq=0 Win=14600 Len=0 MSS=1460 SACK_PERM=1 TSval=353568644 TSecr=0 WS=2
38,3.045254,192.168.1.108,192.168.1.181,TCP,74,"2869 > 34154 [SYN, ACK] Seq=0 Ack=1 Win=8192 Len=0 MSS=1460 WS=256 SACK_PERM=1 TSval=50650 TSecr=353568644"
39,3.047049,192.168.1.181,192.168.1.108,TCP,66,34154 > 2869 [ACK] Seq=1 Ack=1 Win=14600 Len=0 TSval=353568644 TSecr=50650
40,3.051079,192.168.1.181,192.168.1.108,TCP,1514,[TCP segment of a reassembled PDU]
41,3.052178,192.168.1.181,192.168.1.108,HTTP/XML,309,NOTIFY /upnp/eventing/eqtgyiqumt HTTP/1.1 
42,3.052262,192.168.1.108,192.168.1.181,TCP,66,2869 > 34154 [ACK] Seq=1 Ack=1692 Win=66560 Len=0 TSval=50650 TSecr=353568644
43,3.052482,192.168.1.108,192.168.1.181,HTTP,191,HTTP/1.1 200 OK 
44,3.05511,192.168.1.181,192.168.1.108,TCP,66,34154 > 2869 [ACK] Seq=1692 Ack=126 Win=14600 Len=0 TSval=353568645 TSecr=50650
45,3.05517,192.168.1.108,192.168.1.181,TCP,66,"2869 > 34154 [FIN, ACK] Seq=126 Ack=1692 Win=66560 Len=0 TSval=50651 TSecr=353568645"
46,3.056831,192.168.1.181,192.168.1.108,TCP,66,34153 > 2869 [ACK] Seq=1692 Ack=127 Win=14600 Len=0 TSval=353568645 TSecr=50646
47,3.065721,192.168.1.181,192.168.1.108,TCP,66,"34153 > 2869 [FIN, ACK] Seq=1692 Ack=127 Win=14600 Len=0 TSval=353568646 TSecr=50646"
48,3.065768,192.168.1.108,192.168.1.181,TCP,66,2869 > 34153 [ACK] Seq=127 Ack=1693 Win=66560 Len=0 TSval=50652 TSecr=353568646
49,3.071046,192.168.1.181,192.168.1.108,TCP,66,"34154 > 2869 [FIN, ACK] Seq=1692 Ack=127 Win=14600 Len=0 TSval=353568646 TSecr=50651"
50,3.071089,192.168.1.108,192.168.1.181,TCP,66,2869 > 34154 [ACK] Seq=127 Ack=1693 Win=66560 Len=0 TSval=50652 TSecr=353568646
51,3.078421,192.168.1.181,192.168.1.108,TCP,74,34155 > 2869 [SYN] Seq=0 Win=14600 Len=0 MSS=1460 SACK_PERM=1 TSval=353568647 TSecr=0 WS=2
52,3.078618,192.168.1.108,192.168.1.181,TCP,74,"2869 > 34155 [SYN, ACK] Seq=0 Ack=1 Win=8192 Len=0 MSS=1460 WS=256 SACK_PERM=1 TSval=50653 TSecr=353568647"
53,3.080531,192.168.1.181,192.168.1.108,TCP,66,34155 > 2869 [ACK] Seq=1 Ack=1 Win=14600 Len=0 TSval=353568647 TSecr=50653
54,3.09692,192.168.1.181,192.168.1.108,TCP,74,34156 > 2869 [SYN] Seq=0 Win=14600 Len=0 MSS=1460 SACK_PERM=1 TSval=353568649 TSecr=0 WS=2
55,3.097032,192.168.1.108,192.168.1.181,TCP,74,"2869 > 34156 [SYN, ACK] Seq=0 Ack=1 Win=8192 Len=0 MSS=1460 WS=256 SACK_PERM=1 TSval=50655 TSecr=353568649"
56,3.09878,192.168.1.181,192.168.1.108,TCP,66,34156 > 2869 [ACK] Seq=1 Ack=1 Win=14600 Len=0 TSval=353568649 TSecr=50655
57,3.102809,192.168.1.181,192.168.1.108,TCP,1514,[TCP segment of a reassembled PDU]
58,3.105376,192.168.1.181,192.168.1.108,TCP,1514,[TCP segment of a reassembled PDU]
59,3.106387,192.168.1.181,192.168.1.108,HTTP/XML,309,NOTIFY /upnp/eventing/sjvizmxepc HTTP/1.1 
60,3.106441,192.168.1.108,192.168.1.181,TCP,66,2869 > 34155 [ACK] Seq=1 Ack=1692 Win=66560 Len=0 TSval=50656 TSecr=353568650
61,3.106588,192.168.1.108,192.168.1.181,HTTP,191,HTTP/1.1 200 OK 
62,3.108994,192.168.1.181,192.168.1.108,TCP,66,34155 > 2869 [ACK] Seq=1692 Ack=126 Win=14600 Len=0 TSval=353568650 TSecr=50656
63,3.109043,192.168.1.108,192.168.1.181,TCP,66,"2869 > 34155 [FIN, ACK] Seq=126 Ack=1692 Win=66560 Len=0 TSval=50656 TSecr=353568650"
64,3.124096,192.168.1.181,192.168.1.108,HTTP/XML,309,NOTIFY /upnp/eventing/lhnzgxtbdf HTTP/1.1 
65,3.124166,192.168.1.108,192.168.1.181,TCP,66,2869 > 34156 [ACK] Seq=1 Ack=1692 Win=66560 Len=0 TSval=50657 TSecr=353568649
66,3.124357,192.168.1.108,192.168.1.181,HTTP,191,HTTP/1.1 200 OK 
67,3.126693,192.168.1.181,192.168.1.108,TCP,66,34156 > 2869 [ACK] Seq=1692 Ack=126 Win=14600 Len=0 TSval=353568652 TSecr=50657
68,3.126749,192.168.1.108,192.168.1.181,TCP,66,"2869 > 34156 [FIN, ACK] Seq=126 Ack=1692 Win=66560 Len=0 TSval=50658 TSecr=353568652"
69,3.1308,192.168.1.181,192.168.1.108,TCP,66,"34156 > 2869 [FIN, ACK] Seq=1692 Ack=127 Win=14600 Len=0 TSval=353568652 TSecr=50658"
70,3.130854,192.168.1.108,192.168.1.181,TCP,66,2869 > 34156 [ACK] Seq=127 Ack=1693 Win=66560 Len=0 TSval=50658 TSecr=353568652
71,3.143305,192.168.1.181,192.168.1.108,TCP,66,34155 > 2869 [ACK] Seq=1692 Ack=127 Win=14600 Len=0 TSval=353568654 TSecr=50656
72,3.144291,192.168.1.181,192.168.1.108,TCP,66,"34155 > 2869 [FIN, ACK] Seq=1692 Ack=127 Win=14600 Len=0 TSval=353568654 TSecr=50656"
73,3.14434,192.168.1.108,192.168.1.181,TCP,66,2869 > 34155 [ACK] Seq=127 Ack=1693 Win=66560 Len=0 TSval=50659 TSecr=353568654
74,3.150008,192.168.1.181,192.168.1.108,TCP,74,34157 > 2869 [SYN] Seq=0 Win=14600 Len=0 MSS=1460 SACK_PERM=1 TSval=353568654 TSecr=0 WS=2
75,3.150144,192.168.1.108,192.168.1.181,TCP,74,"2869 > 34157 [SYN, ACK] Seq=0 Ack=1 Win=8192 Len=0 MSS=1460 WS=256 SACK_PERM=1 TSval=50660 TSecr=353568654"
76,3.152057,192.168.1.181,192.168.1.108,TCP,66,34157 > 2869 [ACK] Seq=1 Ack=1 Win=14600 Len=0 TSval=353568654 TSecr=50660
77,3.167453,192.168.1.181,192.168.1.108,TCP,74,34158 > 2869 [SYN] Seq=0 Win=14600 Len=0 MSS=1460 SACK_PERM=1 TSval=353568656 TSecr=0 WS=2
78,3.167567,192.168.1.108,192.168.1.181,TCP,74,"2869 > 34158 [SYN, ACK] Seq=0 Ack=1 Win=8192 Len=0 MSS=1460 WS=256 SACK_PERM=1 TSval=50662 TSecr=353568656"
79,3.169488,192.168.1.181,192.168.1.108,TCP,66,34158 > 2869 [ACK] Seq=1 Ack=1 Win=14600 Len=0 TSval=353568656 TSecr=50662
80,3.174384,192.168.1.181,192.168.1.108,TCP,1514,[TCP segment of a reassembled PDU]
81,3.18674,192.168.1.181,192.168.1.108,TCP,1514,[TCP segment of a reassembled PDU]
82,3.187663,192.168.1.181,192.168.1.108,HTTP/XML,308,NOTIFY /upnp/eventing/ebwtxqoamo HTTP/1.1 
83,3.187744,192.168.1.108,192.168.1.181,TCP,66,2869 > 34157 [ACK] Seq=1 Ack=1691 Win=66560 Len=0 TSval=50664 TSecr=353568658
84,3.187958,192.168.1.108,192.168.1.181,HTTP,191,HTTP/1.1 200 OK 
85,3.190338,192.168.1.181,192.168.1.108,TCP,66,34157 > 2869 [ACK] Seq=1691 Ack=126 Win=14600 Len=0 TSval=353568658 TSecr=50664
86,3.190402,192.168.1.108,192.168.1.181,TCP,66,"2869 > 34157 [FIN, ACK] Seq=126 Ack=1691 Win=66560 Len=0 TSval=50664 TSecr=353568658"
87,3.203839,192.168.1.181,192.168.1.108,HTTP/XML,309,NOTIFY /upnp/eventing/bijyeehsex HTTP/1.1 
88,3.20392,192.168.1.108,192.168.1.181,TCP,66,2869 > 34158 [ACK] Seq=1 Ack=1692 Win=66560 Len=0 TSval=50665 TSecr=353568657
89,3.2041,192.168.1.108,192.168.1.181,HTTP,191,HTTP/1.1 200 OK 
90,3.20648,192.168.1.181,192.168.1.108,TCP,66,34158 > 2869 [ACK] Seq=1692 Ack=126 Win=14600 Len=0 TSval=353568660 TSecr=50665
91,3.206529,192.168.1.108,192.168.1.181,TCP,66,"2869 > 34158 [FIN, ACK] Seq=126 Ack=1692 Win=66560 Len=0 TSval=50666 TSecr=353568660"
92,3.210638,192.168.1.181,192.168.1.108,TCP,66,"34158 > 2869 [FIN, ACK] Seq=1692 Ack=127 Win=14600 Len=0 TSval=353568660 TSecr=50666"
93,3.210687,192.168.1.108,192.168.1.181,TCP,66,2869 > 34158 [ACK] Seq=127 Ack=1693 Win=66560 Len=0 TSval=50666 TSecr=353568660
94,3.222759,192.168.1.181,192.168.1.108,TCP,66,34157 > 2869 [ACK] Seq=1691 Ack=127 Win=14600 Len=0 TSval=353568662 TSecr=50664
95,3.225369,192.168.1.181,192.168.1.108,TCP,66,"34157 > 2869 [FIN, ACK] Seq=1691 Ack=127 Win=14600 Len=0 TSval=353568662 TSecr=50664"
96,3.225418,192.168.1.108,192.168.1.181,TCP,66,2869 > 34157 [ACK] Seq=127 Ack=1692 Win=66560 Len=0 TSval=50668 TSecr=353568662
97,3.230784,192.168.1.181,192.168.1.108,TCP,74,34159 > 2869 [SYN] Seq=0 Win=14600 Len=0 MSS=1460 SACK_PERM=1 TSval=353568662 TSecr=0 WS=2
98,3.230931,192.168.1.108,192.168.1.181,TCP,74,"2869 > 34159 [SYN, ACK] Seq=0 Ack=1 Win=8192 Len=0 MSS=1460 WS=256 SACK_PERM=1 TSval=50668 TSecr=353568662"
99,3.233036,192.168.1.181,192.168.1.108,TCP,66,34159 > 2869 [ACK] Seq=1 Ack=1 Win=14600 Len=0 TSval=353568663 TSecr=50668
100,3.246853,192.168.1.181,192.168.1.108,TCP,74,34160 > 2869 [SYN] Seq=0 Win=14600 Len=0 MSS=1460 SACK_PERM=1 TSval=353568664 TSecr=0 WS=2
101,3.246974,192.168.1.108,192.168.1.181,TCP,74,"2869 > 34160 [SYN, ACK] Seq=0 Ack=1 Win=8192 Len=0 MSS=1460 WS=256 SACK_PERM=1 TSval=50670 TSecr=353568664"
102,3.248709,192.168.1.181,192.168.1.108,TCP,66,34160 > 2869 [ACK] Seq=1 Ack=1 Win=14600 Len=0 TSval=353568664 TSecr=50670
103,3.253135,192.168.1.181,192.168.1.108,TCP,1514,[TCP segment of a reassembled PDU]
104,3.266733,192.168.1.181,192.168.1.108,TCP,1514,[TCP segment of a reassembled PDU]
105,3.267717,192.168.1.181,192.168.1.108,HTTP/XML,309,NOTIFY /upnp/eventing/edabcquqlg HTTP/1.1 
106,3.267775,192.168.1.108,192.168.1.181,TCP,66,2869 > 34159 [ACK] Seq=1 Ack=1692 Win=66560 Len=0 TSval=50672 TSecr=353568666
107,3.267968,192.168.1.108,192.168.1.181,HTTP,191,HTTP/1.1 200 OK 
108,3.270366,192.168.1.181,192.168.1.108,TCP,66,34159 > 2869 [ACK] Seq=1692 Ack=126 Win=14600 Len=0 TSval=353568666 TSecr=50672
109,3.270417,192.168.1.108,192.168.1.181,TCP,66,"2869 > 34159 [FIN, ACK] Seq=126 Ack=1692 Win=66560 Len=0 TSval=50672 TSecr=353568666"
110,3.284282,192.168.1.181,192.168.1.108,HTTP/XML,309,NOTIFY /upnp/eventing/eqtgyiqumt HTTP/1.1 
111,3.284352,192.168.1.108,192.168.1.181,TCP,66,2869 > 34160 [ACK] Seq=1 Ack=1692 Win=66560 Len=0 TSval=50673 TSecr=353568665
112,3.284496,192.168.1.108,192.168.1.181,HTTP,191,HTTP/1.1 200 OK 
113,3.286866,192.168.1.181,192.168.1.108,TCP,66,34160 > 2869 [ACK] Seq=1692 Ack=126 Win=14600 Len=0 TSval=353568668 TSecr=50673
114,3.286917,192.168.1.108,192.168.1.181,TCP,66,"2869 > 34160 [FIN, ACK] Seq=126 Ack=1692 Win=66560 Len=0 TSval=50674 TSecr=353568668"
115,3.295832,192.168.1.181,192.168.1.108,TCP,66,"34160 > 2869 [FIN, ACK] Seq=1692 Ack=127 Win=14600 Len=0 TSval=353568669 TSecr=50674"
116,3.2959,192.168.1.108,192.168.1.181,TCP,66,2869 > 34160 [ACK] Seq=127 Ack=1693 Win=66560 Len=0 TSval=50675 TSecr=353568669
117,3.301187,192.168.1.181,192.168.1.108,TCP,74,34161 > 2869 [SYN] Seq=0 Win=14600 Len=0 MSS=1460 SACK_PERM=1 TSval=353568669 TSecr=0 WS=2
118,3.301367,192.168.1.108,192.168.1.181,TCP,74,"2869 > 34161 [SYN, ACK] Seq=0 Ack=1 Win=8192 Len=0 MSS=1460 WS=256 SACK_PERM=1 TSval=50675 TSecr=353568669"
119,3.303426,192.168.1.181,192.168.1.108,TCP,66,34161 > 2869 [ACK] Seq=1 Ack=1 Win=14600 Len=0 TSval=353568670 TSecr=50675
120,3.303892,192.168.1.181,192.168.1.108,TCP,66,34159 > 2869 [ACK] Seq=1692 Ack=127 Win=14600 Len=0 TSval=353568670 TSecr=50672
121,3.30694,192.168.1.181,192.168.1.108,TCP,66,"34159 > 2869 [FIN, ACK] Seq=1692 Ack=127 Win=14600 Len=0 TSval=353568670 TSecr=50672"
122,3.306997,192.168.1.108,192.168.1.181,TCP,66,2869 > 34159 [ACK] Seq=127 Ack=1693 Win=66560 Len=0 TSval=50676 TSecr=353568670
123,3.312773,192.168.1.181,192.168.1.108,TCP,74,34162 > 2869 [SYN] Seq=0 Win=14600 Len=0 MSS=1460 SACK_PERM=1 TSval=353568671 TSecr=0 WS=2
124,3.312906,192.168.1.108,192.168.1.181,TCP,74,"2869 > 34162 [SYN, ACK] Seq=0 Ack=1 Win=8192 Len=0 MSS=1460 WS=256 SACK_PERM=1 TSval=50676 TSecr=353568671"
125,3.314693,192.168.1.181,192.168.1.108,TCP,66,34162 > 2869 [ACK] Seq=1 Ack=1 Win=14600 Len=0 TSval=353568671 TSecr=50676
126,3.326213,192.168.1.181,192.168.1.108,TCP,1514,[TCP segment of a reassembled PDU]
127,3.327252,192.168.1.181,192.168.1.108,HTTP/XML,309,NOTIFY /upnp/eventing/sjvizmxepc HTTP/1.1 
128,3.327315,192.168.1.108,192.168.1.181,TCP,66,2869 > 34161 [ACK] Seq=1 Ack=1692 Win=66560 Len=0 TSval=50678 TSecr=353568672
129,3.327477,192.168.1.108,192.168.1.181,HTTP,191,HTTP/1.1 200 OK 
130,3.329904,192.168.1.181,192.168.1.108,TCP,66,34161 > 2869 [ACK] Seq=1692 Ack=126 Win=14600 Len=0 TSval=353568672 TSecr=50678
131,3.329951,192.168.1.108,192.168.1.181,TCP,66,"2869 > 34161 [FIN, ACK] Seq=126 Ack=1692 Win=66560 Len=0 TSval=50678 TSecr=353568672"
132,3.346221,192.168.1.181,192.168.1.108,TCP,1514,[TCP segment of a reassembled PDU]
133,3.34723,192.168.1.181,192.168.1.108,HTTP/XML,309,NOTIFY /upnp/eventing/lhnzgxtbdf HTTP/1.1 
134,3.3473,192.168.1.108,192.168.1.181,TCP,66,2869 > 34162 [ACK] Seq=1 Ack=1692 Win=66560 Len=0 TSval=50680 TSecr=353568674
135,3.347399,192.168.1.108,192.168.1.181,HTTP,191,HTTP/1.1 200 OK 
136,3.349661,192.168.1.181,192.168.1.108,TCP,66,34162 > 2869 [ACK] Seq=1692 Ack=126 Win=14600 Len=0 TSval=353568674 TSecr=50680
137,3.349715,192.168.1.108,192.168.1.181,TCP,66,"2869 > 34162 [FIN, ACK] Seq=126 Ack=1692 Win=66560 Len=0 TSval=50680 TSecr=353568674"
138,3.362443,192.168.1.181,192.168.1.108,TCP,66,34161 > 2869 [ACK] Seq=1692 Ack=127 Win=14600 Len=0 TSval=353568676 TSecr=50678
139,3.364783,192.168.1.181,192.168.1.108,TCP,66,"34161 > 2869 [FIN, ACK] Seq=1692 Ack=127 Win=14600 Len=0 TSval=353568676 TSecr=50678"
140,3.36484,192.168.1.108,192.168.1.181,TCP,66,2869 > 34161 [ACK] Seq=127 Ack=1693 Win=66560 Len=0 TSval=50682 TSecr=353568676
141,3.370505,192.168.1.181,192.168.1.108,TCP,74,34163 > 2869 [SYN] Seq=0 Win=14600 Len=0 MSS=1460 SACK_PERM=1 TSval=353568676 TSecr=0 WS=2
142,3.370672,192.168.1.108,192.168.1.181,TCP,74,"2869 > 34163 [SYN, ACK] Seq=0 Ack=1 Win=8192 Len=0 MSS=1460 WS=256 SACK_PERM=1 TSval=50682 TSecr=353568676"
143,3.372752,192.168.1.181,192.168.1.108,TCP,66,34163 > 2869 [ACK] Seq=1 Ack=1 Win=14600 Len=0 TSval=353568677 TSecr=50682
144,3.382974,192.168.1.181,192.168.1.108,TCP,66,34162 > 2869 [ACK] Seq=1692 Ack=127 Win=14600 Len=0 TSval=353568678 TSecr=50680
145,3.38564,192.168.1.181,192.168.1.108,TCP,66,"34162 > 2869 [FIN, ACK] Seq=1692 Ack=127 Win=14600 Len=0 TSval=353568678 TSecr=50680"
146,3.385696,192.168.1.108,192.168.1.181,TCP,66,2869 > 34162 [ACK] Seq=127 Ack=1693 Win=66560 Len=0 TSval=50684 TSecr=353568678
147,3.391542,192.168.1.181,192.168.1.108,TCP,74,34164 > 2869 [SYN] Seq=0 Win=14600 Len=0 MSS=1460 SACK_PERM=1 TSval=353568678 TSecr=0 WS=2
148,3.391677,192.168.1.108,192.168.1.181,TCP,74,"2869 > 34164 [SYN, ACK] Seq=0 Ack=1 Win=8192 Len=0 MSS=1460 WS=256 SACK_PERM=1 TSval=50684 TSecr=353568678"
149,3.394346,192.168.1.181,192.168.1.108,TCP,66,34164 > 2869 [ACK] Seq=1 Ack=1 Win=14600 Len=0 TSval=353568679 TSecr=50684
150,3.406055,192.168.1.181,192.168.1.108,TCP,1514,[TCP segment of a reassembled PDU]
151,3.407,192.168.1.181,192.168.1.108,HTTP/XML,308,NOTIFY /upnp/eventing/ebwtxqoamo HTTP/1.1 
152,3.40708,192.168.1.108,192.168.1.181,TCP,66,2869 > 34163 [ACK] Seq=1 Ack=1691 Win=66560 Len=0 TSval=50686 TSecr=353568680
153,3.407294,192.168.1.108,192.168.1.181,HTTP,191,HTTP/1.1 200 OK 
154,3.409656,192.168.1.181,192.168.1.108,TCP,66,34163 > 2869 [ACK] Seq=1691 Ack=126 Win=14600 Len=0 TSval=353568680 TSecr=50686
155,3.409719,192.168.1.108,192.168.1.181,TCP,66,"2869 > 34163 [FIN, ACK] Seq=126 Ack=1691 Win=66560 Len=0 TSval=50686 TSecr=353568680"
156,3.413954,fe80::5034:59dc:7b1d:2e8c,ff02::c,SSDP,208,M-SEARCH * HTTP/1.1 
157,3.426476,192.168.1.181,192.168.1.108,TCP,1514,[TCP segment of a reassembled PDU]
158,3.427496,192.168.1.181,192.168.1.108,HTTP/XML,309,NOTIFY /upnp/eventing/bijyeehsex HTTP/1.1 
159,3.427519,192.168.1.108,192.168.1.181,TCP,66,2869 > 34164 [ACK] Seq=1 Ack=1692 Win=66560 Len=0 TSval=50688 TSecr=353568682
160,3.427564,192.168.1.108,192.168.1.181,HTTP,191,HTTP/1.1 200 OK 
161,3.429892,192.168.1.181,192.168.1.108,TCP,66,34164 > 2869 [ACK] Seq=1692 Ack=126 Win=14600 Len=0 TSval=353568682 TSecr=50688
162,3.429912,192.168.1.108,192.168.1.181,TCP,66,"2869 > 34164 [FIN, ACK] Seq=126 Ack=1692 Win=66560 Len=0 TSval=50688 TSecr=353568682"
163,3.442183,192.168.1.181,192.168.1.108,TCP,66,34163 > 2869 [ACK] Seq=1691 Ack=127 Win=14600 Len=0 TSval=353568684 TSecr=50686
164,3.44452,192.168.1.181,192.168.1.108,TCP,66,"34163 > 2869 [FIN, ACK] Seq=1691 Ack=127 Win=14600 Len=0 TSval=353568684 TSecr=50686"
165,3.444574,192.168.1.108,192.168.1.181,TCP,66,2869 > 34163 [ACK] Seq=127 Ack=1692 Win=66560 Len=0 TSval=50689 TSecr=353568684
166,3.4546,192.168.1.181,192.168.1.108,TCP,66,"34164 > 2869 [FIN, ACK] Seq=1692 Ack=127 Win=14600 Len=0 TSval=353568685 TSecr=50688"
167,3.454669,192.168.1.108,192.168.1.181,TCP,66,2869 > 34164 [ACK] Seq=127 Ack=1693 Win=66560 Len=0 TSval=50691 TSecr=353568685
168,3.46589,192.168.1.181,192.168.1.108,TCP,74,34165 > 2869 [SYN] Seq=0 Win=14600 Len=0 MSS=1460 SACK_PERM=1 TSval=353568686 TSecr=0 WS=2
169,3.466128,192.168.1.108,192.168.1.181,TCP,74,"2869 > 34165 [SYN, ACK] Seq=0 Ack=1 Win=8192 Len=0 MSS=1460 WS=256 SACK_PERM=1 TSval=50692 TSecr=353568686"
170,3.468247,192.168.1.181,192.168.1.108,TCP,66,34165 > 2869 [ACK] Seq=1 Ack=1 Win=14600 Len=0 TSval=353568686 TSecr=50692
171,3.47264,192.168.1.181,192.168.1.108,TCP,1514,[TCP segment of a reassembled PDU]
172,3.493171,192.168.1.181,192.168.1.108,HTTP/XML,313,NOTIFY /upnp/eventing/eqtgyiqumt HTTP/1.1 
173,3.493253,192.168.1.108,192.168.1.181,TCP,66,2869 > 34165 [ACK] Seq=1 Ack=1696 Win=66560 Len=0 TSval=50694 TSecr=353568686
174,3.493473,192.168.1.108,192.168.1.181,HTTP,191,HTTP/1.1 200 OK 
175,3.495869,192.168.1.181,192.168.1.108,TCP,66,34165 > 2869 [ACK] Seq=1696 Ack=126 Win=14600 Len=0 TSval=353568689 TSecr=50694
176,3.495932,192.168.1.108,192.168.1.181,TCP,66,"2869 > 34165 [FIN, ACK] Seq=126 Ack=1696 Win=66560 Len=0 TSval=50695 TSecr=353568689"
177,3.49983,192.168.1.181,192.168.1.108,TCP,66,"34165 > 2869 [FIN, ACK] Seq=1696 Ack=127 Win=14600 Len=0 TSval=353568689 TSecr=50695"
178,3.499897,192.168.1.108,192.168.1.181,TCP,66,2869 > 34165 [ACK] Seq=127 Ack=1697 Win=66560 Len=0 TSval=50695 TSecr=353568689
179,3.512856,192.168.1.181,192.168.1.108,TCP,74,34166 > 2869 [SYN] Seq=0 Win=14600 Len=0 MSS=1460 SACK_PERM=1 TSval=353568691 TSecr=0 WS=2
180,3.513004,192.168.1.108,192.168.1.181,TCP,74,"2869 > 34166 [SYN, ACK] Seq=0 Ack=1 Win=8192 Len=0 MSS=1460 WS=256 SACK_PERM=1 TSval=50696 TSecr=353568691"
181,3.514798,192.168.1.181,192.168.1.108,TCP,66,34166 > 2869 [ACK] Seq=1 Ack=1 Win=14600 Len=0 TSval=353568691 TSecr=50696
182,3.520571,192.168.1.181,192.168.1.108,TCP,1514,[TCP segment of a reassembled PDU]
183,3.521977,192.168.1.181,192.168.1.108,HTTP/XML,313,NOTIFY /upnp/eventing/edabcquqlg HTTP/1.1 
184,3.522046,192.168.1.108,192.168.1.181,TCP,66,2869 > 34166 [ACK] Seq=1 Ack=1696 Win=66560 Len=0 TSval=50697 TSecr=353568691
185,3.522157,192.168.1.108,192.168.1.181,HTTP,191,HTTP/1.1 200 OK 
186,3.524638,192.168.1.181,192.168.1.108,TCP,66,34166 > 2869 [ACK] Seq=1696 Ack=126 Win=14600 Len=0 TSval=353568692 TSecr=50697
187,3.524692,192.168.1.108,192.168.1.181,TCP,66,"2869 > 34166 [FIN, ACK] Seq=126 Ack=1696 Win=66560 Len=0 TSval=50698 TSecr=353568692"
188,3.529776,192.168.1.181,192.168.1.108,TCP,74,34167 > 2869 [SYN] Seq=0 Win=14600 Len=0 MSS=1460 SACK_PERM=1 TSval=353568692 TSecr=0 WS=2
189,3.529894,192.168.1.108,192.168.1.181,TCP,74,"2869 > 34167 [SYN, ACK] Seq=0 Ack=1 Win=8192 Len=0 MSS=1460 WS=256 SACK_PERM=1 TSval=50698 TSecr=353568692"
190,3.532009,192.168.1.181,192.168.1.108,TCP,66,34167 > 2869 [ACK] Seq=1 Ack=1 Win=14600 Len=0 TSval=353568693 TSecr=50698
191,3.544591,192.168.1.181,192.168.1.108,TCP,66,"34166 > 2869 [FIN, ACK] Seq=1696 Ack=127 Win=14600 Len=0 TSval=353568694 TSecr=50698"
192,3.544656,192.168.1.108,192.168.1.181,TCP,66,2869 > 34166 [ACK] Seq=127 Ack=1697 Win=66560 Len=0 TSval=50700 TSecr=353568694
193,3.551151,192.168.1.181,192.168.1.108,TCP,1514,[TCP segment of a reassembled PDU]
194,3.556005,192.168.1.181,192.168.1.108,TCP,74,34168 > 2869 [SYN] Seq=0 Win=14600 Len=0 MSS=1460 SACK_PERM=1 TSval=353568695 TSecr=0 WS=2
195,3.556143,192.168.1.108,192.168.1.181,TCP,74,"2869 > 34168 [SYN, ACK] Seq=0 Ack=1 Win=8192 Len=0 MSS=1460 WS=256 SACK_PERM=1 TSval=50701 TSecr=353568695"
196,3.558065,192.168.1.181,192.168.1.108,TCP,66,34168 > 2869 [ACK] Seq=1 Ack=1 Win=14600 Len=0 TSval=353568695 TSecr=50701
197,3.562243,192.168.1.181,192.168.1.108,TCP,1514,[TCP segment of a reassembled PDU]
198,3.572697,192.168.1.181,192.168.1.108,HTTP/XML,313,NOTIFY /upnp/eventing/sjvizmxepc HTTP/1.1 
199,3.572779,192.168.1.108,192.168.1.181,TCP,66,2869 > 34167 [ACK] Seq=1 Ack=1696 Win=66560 Len=0 TSval=50702 TSecr=353568694
200,3.57299,192.168.1.108,192.168.1.181,HTTP,191,HTTP/1.1 200 OK 
201,3.575385,192.168.1.181,192.168.1.108,TCP,66,34167 > 2869 [ACK] Seq=1696 Ack=126 Win=14600 Len=0 TSval=353568697 TSecr=50702
202,3.575447,192.168.1.108,192.168.1.181,TCP,66,"2869 > 34167 [FIN, ACK] Seq=126 Ack=1696 Win=66560 Len=0 TSval=50703 TSecr=353568697"
203,3.578262,192.168.1.181,192.168.1.108,HTTP/XML,313,NOTIFY /upnp/eventing/lhnzgxtbdf HTTP/1.1 
204,3.578342,192.168.1.108,192.168.1.181,TCP,66,2869 > 34168 [ACK] Seq=1 Ack=1696 Win=66560 Len=0 TSval=50703 TSecr=353568695
205,3.578534,192.168.1.108,192.168.1.181,HTTP,191,HTTP/1.1 200 OK 
206,3.580876,192.168.1.181,192.168.1.108,TCP,66,34168 > 2869 [ACK] Seq=1696 Ack=126 Win=14600 Len=0 TSval=353568697 TSecr=50703
207,3.580937,192.168.1.108,192.168.1.181,TCP,66,"2869 > 34168 [FIN, ACK] Seq=126 Ack=1696 Win=66560 Len=0 TSval=50703 TSecr=353568697"
208,3.585561,192.168.1.181,192.168.1.108,TCP,66,"34167 > 2869 [FIN, ACK] Seq=1696 Ack=127 Win=14600 Len=0 TSval=353568698 TSecr=50703"
209,3.585628,192.168.1.108,192.168.1.181,TCP,66,2869 > 34167 [ACK] Seq=127 Ack=1697 Win=66560 Len=0 TSval=50704 TSecr=353568698
210,3.59181,192.168.1.181,192.168.1.108,TCP,74,34169 > 2869 [SYN] Seq=0 Win=14600 Len=0 MSS=1460 SACK_PERM=1 TSval=353568698 TSecr=0 WS=2
211,3.591948,192.168.1.108,192.168.1.181,TCP,74,"2869 > 34169 [SYN, ACK] Seq=0 Ack=1 Win=8192 Len=0 MSS=1460 WS=256 SACK_PERM=1 TSval=50704 TSecr=353568698"
212,3.593723,192.168.1.181,192.168.1.108,TCP,66,34169 > 2869 [ACK] Seq=1 Ack=1 Win=14600 Len=0 TSval=353568699 TSecr=50704
213,3.604584,192.168.1.181,192.168.1.108,TCP,66,"34168 > 2869 [FIN, ACK] Seq=1696 Ack=127 Win=14600 Len=0 TSval=353568700 TSecr=50703"
214,3.60465,192.168.1.108,192.168.1.181,TCP,66,2869 > 34168 [ACK] Seq=127 Ack=1697 Win=66560 Len=0 TSval=50706 TSecr=353568700
215,3.610409,192.168.1.181,192.168.1.108,TCP,74,34170 > 2869 [SYN] Seq=0 Win=14600 Len=0 MSS=1460 SACK_PERM=1 TSval=353568700 TSecr=0 WS=2
216,3.610542,192.168.1.108,192.168.1.181,TCP,74,"2869 > 34170 [SYN, ACK] Seq=0 Ack=1 Win=8192 Len=0 MSS=1460 WS=256 SACK_PERM=1 TSval=50706 TSecr=353568700"
217,3.613042,192.168.1.181,192.168.1.108,TCP,66,34170 > 2869 [ACK] Seq=1 Ack=1 Win=14600 Len=0 TSval=353568701 TSecr=50706
218,3.635225,192.168.1.181,192.168.1.108,TCP,1514,[TCP segment of a reassembled PDU]
219,3.636262,192.168.1.181,192.168.1.108,HTTP/XML,313,NOTIFY /upnp/eventing/bijyeehsex HTTP/1.1 
220,3.636343,192.168.1.108,192.168.1.181,TCP,66,2869 > 34170 [ACK] Seq=1 Ack=1696 Win=66560 Len=0 TSval=50709 TSecr=353568703
221,3.636554,192.168.1.108,192.168.1.181,HTTP,191,HTTP/1.1 200 OK 
222,3.638913,192.168.1.181,192.168.1.108,TCP,66,34170 > 2869 [ACK] Seq=1696 Ack=126 Win=14600 Len=0 TSval=353568703 TSecr=50709
223,3.638975,192.168.1.108,192.168.1.181,TCP,66,"2869 > 34170 [FIN, ACK] Seq=126 Ack=1696 Win=66560 Len=0 TSval=50709 TSecr=353568703"
224,3.643767,192.168.1.181,192.168.1.108,TCP,1514,[TCP segment of a reassembled PDU]
225,3.6448,192.168.1.181,192.168.1.108,HTTP/XML,312,NOTIFY /upnp/eventing/ebwtxqoamo HTTP/1.1 
226,3.644894,192.168.1.108,192.168.1.181,TCP,66,2869 > 34169 [ACK] Seq=1 Ack=1695 Win=66560 Len=0 TSval=50710 TSecr=353568704
227,3.645052,192.168.1.108,192.168.1.181,HTTP,191,HTTP/1.1 200 OK 
228,3.647487,192.168.1.181,192.168.1.108,TCP,66,34169 > 2869 [ACK] Seq=1695 Ack=126 Win=14600 Len=0 TSval=353568704 TSecr=50710
229,3.647537,192.168.1.108,192.168.1.181,TCP,66,"2869 > 34169 [FIN, ACK] Seq=126 Ack=1695 Win=66560 Len=0 TSval=50710 TSecr=353568704"
230,3.663401,192.168.1.181,192.168.1.108,TCP,66,"34170 > 2869 [FIN, ACK] Seq=1696 Ack=127 Win=14600 Len=0 TSval=353568706 TSecr=50709"
231,3.663478,192.168.1.108,192.168.1.181,TCP,66,2869 > 34170 [ACK] Seq=127 Ack=1697 Win=66560 Len=0 TSval=50711 TSecr=353568706
232,3.668998,192.168.1.181,192.168.1.108,TCP,74,34171 > 2869 [SYN] Seq=0 Win=14600 Len=0 MSS=1460 SACK_PERM=1 TSval=353568706 TSecr=0 WS=2
233,3.669183,192.168.1.108,192.168.1.181,TCP,74,"2869 > 34171 [SYN, ACK] Seq=0 Ack=1 Win=8192 Len=0 MSS=1460 WS=256 SACK_PERM=1 TSval=50712 TSecr=353568706"
234,3.671271,192.168.1.181,192.168.1.108,TCP,66,34171 > 2869 [ACK] Seq=1 Ack=1 Win=14600 Len=0 TSval=353568706 TSecr=50712
235,3.672598,192.168.1.181,192.168.1.108,TCP,66,"34169 > 2869 [FIN, ACK] Seq=1695 Ack=127 Win=14600 Len=0 TSval=353568707 TSecr=50710"
236,3.67267,192.168.1.108,192.168.1.181,TCP,66,2869 > 34169 [ACK] Seq=127 Ack=1696 Win=66560 Len=0 TSval=50712 TSecr=353568707
237,3.678203,192.168.1.181,192.168.1.108,TCP,74,34172 > 2869 [SYN] Seq=0 Win=14600 Len=0 MSS=1460 SACK_PERM=1 TSval=353568707 TSecr=0 WS=2
238,3.678336,192.168.1.108,192.168.1.181,TCP,74,"2869 > 34172 [SYN, ACK] Seq=0 Ack=1 Win=8192 Len=0 MSS=1460 WS=256 SACK_PERM=1 TSval=50713 TSecr=353568707"
239,3.680108,192.168.1.181,192.168.1.108,TCP,66,34172 > 2869 [ACK] Seq=1 Ack=1 Win=14600 Len=0 TSval=353568707 TSecr=50713
240,3.695186,192.168.1.181,192.168.1.108,TCP,1514,[TCP segment of a reassembled PDU]
241,3.69627,192.168.1.181,192.168.1.108,HTTP/XML,313,NOTIFY /upnp/eventing/edabcquqlg HTTP/1.1 
242,3.696352,192.168.1.108,192.168.1.181,TCP,66,2869 > 34171 [ACK] Seq=1 Ack=1696 Win=66560 Len=0 TSval=50715 TSecr=353568709
243,3.696501,192.168.1.108,192.168.1.181,HTTP,191,HTTP/1.1 200 OK 
244,3.698866,192.168.1.181,192.168.1.108,TCP,66,34171 > 2869 [ACK] Seq=1696 Ack=126 Win=14600 Len=0 TSval=353568709 TSecr=50715
245,3.698934,192.168.1.108,192.168.1.181,TCP,66,"2869 > 34171 [FIN, ACK] Seq=126 Ack=1696 Win=66560 Len=0 TSval=50715 TSecr=353568709"
246,3.704669,192.168.1.181,192.168.1.108,TCP,1514,[TCP segment of a reassembled PDU]
247,3.705719,192.168.1.181,192.168.1.108,HTTP/XML,313,NOTIFY /upnp/eventing/eqtgyiqumt HTTP/1.1 
248,3.7058,192.168.1.108,192.168.1.181,TCP,66,2869 > 34172 [ACK] Seq=1 Ack=1696 Win=66560 Len=0 TSval=50716 TSecr=353568710
249,3.705911,192.168.1.108,192.168.1.181,HTTP,191,HTTP/1.1 200 OK 
250,3.708356,192.168.1.181,192.168.1.108,TCP,66,34172 > 2869 [ACK] Seq=1696 Ack=126 Win=14600 Len=0 TSval=353568710 TSecr=50716
251,3.708419,192.168.1.108,192.168.1.181,TCP,66,"2869 > 34172 [FIN, ACK] Seq=126 Ack=1696 Win=66560 Len=0 TSval=50716 TSecr=353568710"
252,3.723355,192.168.1.181,192.168.1.108,TCP,66,"34171 > 2869 [FIN, ACK] Seq=1696 Ack=127 Win=14600 Len=0 TSval=353568712 TSecr=50715"
253,3.723434,192.168.1.108,192.168.1.181,TCP,66,2869 > 34171 [ACK] Seq=127 Ack=1697 Win=66560 Len=0 TSval=50717 TSecr=353568712
254,3.728723,192.168.1.181,192.168.1.108,TCP,74,34173 > 2869 [SYN] Seq=0 Win=14600 Len=0 MSS=1460 SACK_PERM=1 TSval=353568712 TSecr=0 WS=2
255,3.728872,192.168.1.108,192.168.1.181,TCP,74,"2869 > 34173 [SYN, ACK] Seq=0 Ack=1 Win=8192 Len=0 MSS=1460 WS=256 SACK_PERM=1 TSval=50718 TSecr=353568712"
256,3.730724,192.168.1.181,192.168.1.108,TCP,66,34173 > 2869 [ACK] Seq=1 Ack=1 Win=14600 Len=0 TSval=353568712 TSecr=50718
257,3.73335,192.168.1.181,192.168.1.108,TCP,66,"34172 > 2869 [FIN, ACK] Seq=1696 Ack=127 Win=14600 Len=0 TSval=353568713 TSecr=50716"
258,3.733417,192.168.1.108,192.168.1.181,TCP,66,2869 > 34172 [ACK] Seq=127 Ack=1697 Win=66560 Len=0 TSval=50718 TSecr=353568713
259,3.738687,192.168.1.181,192.168.1.108,TCP,74,34174 > 2869 [SYN] Seq=0 Win=14600 Len=0 MSS=1460 SACK_PERM=1 TSval=353568713 TSecr=0 WS=2
260,3.738821,192.168.1.108,192.168.1.181,TCP,74,"2869 > 34174 [SYN, ACK] Seq=0 Ack=1 Win=8192 Len=0 MSS=1460 WS=256 SACK_PERM=1 TSval=50719 TSecr=353568713"
261,3.740564,192.168.1.181,192.168.1.108,TCP,66,34174 > 2869 [ACK] Seq=1 Ack=1 Win=14600 Len=0 TSval=353568713 TSecr=50719
262,3.755085,192.168.1.181,192.168.1.108,TCP,1514,[TCP segment of a reassembled PDU]
263,3.756442,192.168.1.181,192.168.1.108,HTTP/XML,313,NOTIFY /upnp/eventing/sjvizmxepc HTTP/1.1 
264,3.756511,192.168.1.108,192.168.1.181,TCP,66,2869 > 34173 [ACK] Seq=1 Ack=1696 Win=66560 Len=0 TSval=50721 TSecr=353568715
265,3.756653,192.168.1.108,192.168.1.181,HTTP,191,HTTP/1.1 200 OK 
266,3.759137,192.168.1.181,192.168.1.108,TCP,66,34173 > 2869 [ACK] Seq=1696 Ack=126 Win=14600 Len=0 TSval=353568715 TSecr=50721
267,3.759185,192.168.1.108,192.168.1.181,TCP,66,"2869 > 34173 [FIN, ACK] Seq=126 Ack=1696 Win=66560 Len=0 TSval=50721 TSecr=353568715"
268,3.763664,192.168.1.181,192.168.1.108,TCP,66,"34173 > 2869 [FIN, ACK] Seq=1696 Ack=127 Win=14600 Len=0 TSval=353568716 TSecr=50721"
269,3.763712,192.168.1.108,192.168.1.181,TCP,66,2869 > 34173 [ACK] Seq=127 Ack=1697 Win=66560 Len=0 TSval=50721 TSecr=353568716
270,3.769323,192.168.1.181,192.168.1.108,TCP,74,34175 > 2869 [SYN] Seq=0 Win=14600 Len=0 MSS=1460 SACK_PERM=1 TSval=353568716 TSecr=0 WS=2
271,3.769456,192.168.1.108,192.168.1.181,TCP,74,"2869 > 34175 [SYN, ACK] Seq=0 Ack=1 Win=8192 Len=0 MSS=1460 WS=256 SACK_PERM=1 TSval=50722 TSecr=353568716"
272,3.771522,192.168.1.181,192.168.1.108,TCP,66,34175 > 2869 [ACK] Seq=1 Ack=1 Win=14600 Len=0 TSval=353568717 TSecr=50722
273,3.784897,192.168.1.181,192.168.1.108,TCP,1514,[TCP segment of a reassembled PDU]
274,3.785944,192.168.1.181,192.168.1.108,HTTP/XML,313,NOTIFY /upnp/eventing/lhnzgxtbdf HTTP/1.1 
275,3.786025,192.168.1.108,192.168.1.181,TCP,66,2869 > 34174 [ACK] Seq=1 Ack=1696 Win=66560 Len=0 TSval=50724 TSecr=353568718
276,3.786139,192.168.1.108,192.168.1.181,HTTP,191,HTTP/1.1 200 OK 
277,3.788599,192.168.1.181,192.168.1.108,TCP,66,34174 > 2869 [ACK] Seq=1696 Ack=126 Win=14600 Len=0 TSval=353568718 TSecr=50724
278,3.788647,192.168.1.108,192.168.1.181,TCP,66,"2869 > 34174 [FIN, ACK] Seq=126 Ack=1696 Win=66560 Len=0 TSval=50724 TSecr=353568718"
279,3.794556,192.168.1.181,192.168.1.108,TCP,1514,[TCP segment of a reassembled PDU]
280,3.79562,192.168.1.181,192.168.1.108,HTTP/XML,312,NOTIFY /upnp/eventing/ebwtxqoamo HTTP/1.1 
281,3.795675,192.168.1.108,192.168.1.181,TCP,66,2869 > 34175 [ACK] Seq=1 Ack=1695 Win=66560 Len=0 TSval=50725 TSecr=353568719
282,3.795792,192.168.1.108,192.168.1.181,HTTP,191,HTTP/1.1 200 OK 
283,3.798231,192.168.1.181,192.168.1.108,TCP,66,34175 > 2869 [ACK] Seq=1695 Ack=126 Win=14600 Len=0 TSval=353568719 TSecr=50725
284,3.798275,192.168.1.108,192.168.1.181,TCP,66,"2869 > 34175 [FIN, ACK] Seq=126 Ack=1695 Win=66560 Len=0 TSval=50725 TSecr=353568719"
285,3.812976,192.168.1.181,192.168.1.108,TCP,66,"34174 > 2869 [FIN, ACK] Seq=1696 Ack=127 Win=14600 Len=0 TSval=353568721 TSecr=50724"
286,3.813024,192.168.1.108,192.168.1.181,TCP,66,2869 > 34174 [ACK] Seq=127 Ack=1697 Win=66560 Len=0 TSval=50726 TSecr=353568721
287,3.818903,192.168.1.181,192.168.1.108,TCP,74,34176 > 2869 [SYN] Seq=0 Win=14600 Len=0 MSS=1460 SACK_PERM=1 TSval=353568721 TSecr=0 WS=2
288,3.819075,192.168.1.108,192.168.1.181,TCP,74,"2869 > 34176 [SYN, ACK] Seq=0 Ack=1 Win=8192 Len=0 MSS=1460 WS=256 SACK_PERM=1 TSval=50727 TSecr=353568721"
289,3.821111,192.168.1.181,192.168.1.108,TCP,66,34176 > 2869 [ACK] Seq=1 Ack=1 Win=14600 Len=0 TSval=353568722 TSecr=50727
290,3.823735,192.168.1.181,192.168.1.108,TCP,66,"34175 > 2869 [FIN, ACK] Seq=1695 Ack=127 Win=14600 Len=0 TSval=353568722 TSecr=50725"
291,3.823788,192.168.1.108,192.168.1.181,TCP,66,2869 > 34175 [ACK] Seq=127 Ack=1696 Win=66560 Len=0 TSval=50727 TSecr=353568722
292,3.829206,192.168.1.181,192.168.1.108,TCP,74,34177 > 2869 [SYN] Seq=0 Win=14600 Len=0 MSS=1460 SACK_PERM=1 TSval=353568722 TSecr=0 WS=2
293,3.829321,192.168.1.108,192.168.1.181,TCP,74,"2869 > 34177 [SYN, ACK] Seq=0 Ack=1 Win=8192 Len=0 MSS=1460 WS=256 SACK_PERM=1 TSval=50728 TSecr=353568722"
294,3.831357,192.168.1.181,192.168.1.108,TCP,66,34177 > 2869 [ACK] Seq=1 Ack=1 Win=14600 Len=0 TSval=353568723 TSecr=50728
295,3.844706,192.168.1.181,192.168.1.108,TCP,1514,[TCP segment of a reassembled PDU]
296,3.845741,192.168.1.181,192.168.1.108,HTTP/XML,313,NOTIFY /upnp/eventing/bijyeehsex HTTP/1.1 
297,3.845807,192.168.1.108,192.168.1.181,TCP,66,2869 > 34176 [ACK] Seq=1 Ack=1696 Win=66560 Len=0 TSval=50730 TSecr=353568724
298,3.84599,192.168.1.108,192.168.1.181,HTTP,191,HTTP/1.1 200 OK 
299,3.848391,192.168.1.181,192.168.1.108,TCP,66,34176 > 2869 [ACK] Seq=1696 Ack=126 Win=14600 Len=0 TSval=353568724 TSecr=50730
300,3.848437,192.168.1.108,192.168.1.181,TCP,66,"2869 > 34176 [FIN, ACK] Seq=126 Ack=1696 Win=66560 Len=0 TSval=50730 TSecr=353568724"
301,3.854461,192.168.1.181,192.168.1.108,TCP,1514,[TCP segment of a reassembled PDU]
302,3.855546,192.168.1.181,192.168.1.108,HTTP/XML,309,NOTIFY /upnp/eventing/edabcquqlg HTTP/1.1 
303,3.855601,192.168.1.108,192.168.1.181,TCP,66,2869 > 34177 [ACK] Seq=1 Ack=1692 Win=66560 Len=0 TSval=50731 TSecr=353568725
304,3.855779,192.168.1.108,192.168.1.181,HTTP,191,HTTP/1.1 200 OK 
305,3.858146,192.168.1.181,192.168.1.108,TCP,66,34177 > 2869 [ACK] Seq=1692 Ack=126 Win=14600 Len=0 TSval=353568725 TSecr=50731
306,3.85819,192.168.1.108,192.168.1.181,TCP,66,"2869 > 34177 [FIN, ACK] Seq=126 Ack=1692 Win=66560 Len=0 TSval=50731 TSecr=353568725"
307,3.872865,192.168.1.181,192.168.1.108,TCP,66,"34176 > 2869 [FIN, ACK] Seq=1696 Ack=127 Win=14600 Len=0 TSval=353568727 TSecr=50730"
308,3.872929,192.168.1.108,192.168.1.181,TCP,66,2869 > 34176 [ACK] Seq=127 Ack=1697 Win=66560 Len=0 TSval=50732 TSecr=353568727
309,3.87863,192.168.1.181,192.168.1.108,TCP,74,34178 > 2869 [SYN] Seq=0 Win=14600 Len=0 MSS=1460 SACK_PERM=1 TSval=353568727 TSecr=0 WS=2
310,3.878819,192.168.1.108,192.168.1.181,TCP,74,"2869 > 34178 [SYN, ACK] Seq=0 Ack=1 Win=8192 Len=0 MSS=1460 WS=256 SACK_PERM=1 TSval=50733 TSecr=353568727"
311,3.880838,192.168.1.181,192.168.1.108,TCP,66,34178 > 2869 [ACK] Seq=1 Ack=1 Win=14600 Len=0 TSval=353568728 TSecr=50733
312,3.883535,192.168.1.181,192.168.1.108,TCP,66,"34177 > 2869 [FIN, ACK] Seq=1692 Ack=127 Win=14600 Len=0 TSval=353568728 TSecr=50731"
313,3.88358,192.168.1.108,192.168.1.181,TCP,66,2869 > 34177 [ACK] Seq=127 Ack=1693 Win=66560 Len=0 TSval=50733 TSecr=353568728
314,3.888761,192.168.1.181,192.168.1.108,TCP,74,34179 > 2869 [SYN] Seq=0 Win=14600 Len=0 MSS=1460 SACK_PERM=1 TSval=353568728 TSecr=0 WS=2
315,3.88884,192.168.1.108,192.168.1.181,TCP,74,"2869 > 34179 [SYN, ACK] Seq=0 Ack=1 Win=8192 Len=0 MSS=1460 WS=256 SACK_PERM=1 TSval=50734 TSecr=353568728"
316,3.890854,192.168.1.181,192.168.1.108,TCP,66,34179 > 2869 [ACK] Seq=1 Ack=1 Win=14600 Len=0 TSval=353568729 TSecr=50734
317,3.904535,192.168.1.181,192.168.1.108,TCP,1514,[TCP segment of a reassembled PDU]
318,3.905591,192.168.1.181,192.168.1.108,HTTP/XML,309,NOTIFY /upnp/eventing/eqtgyiqumt HTTP/1.1 
319,3.905663,192.168.1.108,192.168.1.181,TCP,66,2869 > 34178 [ACK] Seq=1 Ack=1692 Win=66560 Len=0 TSval=50736 TSecr=353568730
320,3.905804,192.168.1.108,192.168.1.181,HTTP,191,HTTP/1.1 200 OK 
321,3.908179,192.168.1.181,192.168.1.108,TCP,66,34178 > 2869 [ACK] Seq=1692 Ack=126 Win=14600 Len=0 TSval=353568730 TSecr=50736
322,3.90825,192.168.1.108,192.168.1.181,TCP,66,"2869 > 34178 [FIN, ACK] Seq=126 Ack=1692 Win=66560 Len=0 TSval=50736 TSecr=353568730"
323,3.914529,192.168.1.181,192.168.1.108,TCP,1514,[TCP segment of a reassembled PDU]
324,3.915618,192.168.1.181,192.168.1.108,HTTP/XML,309,NOTIFY /upnp/eventing/sjvizmxepc HTTP/1.1 
325,3.915677,192.168.1.108,192.168.1.181,TCP,66,2869 > 34179 [ACK] Seq=1 Ack=1692 Win=66560 Len=0 TSval=50737 TSecr=353568731
326,3.915804,192.168.1.108,192.168.1.181,HTTP,191,HTTP/1.1 200 OK 
327,3.918231,192.168.1.181,192.168.1.108,TCP,66,34179 > 2869 [ACK] Seq=1692 Ack=126 Win=14600 Len=0 TSval=353568731 TSecr=50737
328,3.918281,192.168.1.108,192.168.1.181,TCP,66,"2869 > 34179 [FIN, ACK] Seq=126 Ack=1692 Win=66560 Len=0 TSval=50737 TSecr=353568731"
329,3.932683,192.168.1.181,192.168.1.108,TCP,66,"34178 > 2869 [FIN, ACK] Seq=1692 Ack=127 Win=14600 Len=0 TSval=353568733 TSecr=50736"
330,3.932739,192.168.1.108,192.168.1.181,TCP,66,2869 > 34178 [ACK] Seq=127 Ack=1693 Win=66560 Len=0 TSval=50738 TSecr=353568733
331,3.938213,192.168.1.181,192.168.1.108,TCP,74,34180 > 2869 [SYN] Seq=0 Win=14600 Len=0 MSS=1460 SACK_PERM=1 TSval=353568733 TSecr=0 WS=2
332,3.938392,192.168.1.108,192.168.1.181,TCP,74,"2869 > 34180 [SYN, ACK] Seq=0 Ack=1 Win=8192 Len=0 MSS=1460 WS=256 SACK_PERM=1 TSval=50739 TSecr=353568733"
333,3.940754,192.168.1.181,192.168.1.108,TCP,66,34180 > 2869 [ACK] Seq=1 Ack=1 Win=14600 Len=0 TSval=353568733 TSecr=50739
334,3.943976,192.168.1.181,192.168.1.108,TCP,66,"34179 > 2869 [FIN, ACK] Seq=1692 Ack=127 Win=14600 Len=0 TSval=353568734 TSecr=50737"
335,3.944004,192.168.1.108,192.168.1.181,TCP,66,2869 > 34179 [ACK] Seq=127 Ack=1693 Win=66560 Len=0 TSval=50739 TSecr=353568734
336,3.949799,192.168.1.181,192.168.1.108,TCP,74,34181 > 2869 [SYN] Seq=0 Win=14600 Len=0 MSS=1460 SACK_PERM=1 TSval=353568734 TSecr=0 WS=2
337,3.949931,192.168.1.108,192.168.1.181,TCP,74,"2869 > 34181 [SYN, ACK] Seq=0 Ack=1 Win=8192 Len=0 MSS=1460 WS=256 SACK_PERM=1 TSval=50740 TSecr=353568734"
338,3.952211,192.168.1.181,192.168.1.108,TCP,66,34181 > 2869 [ACK] Seq=1 Ack=1 Win=14600 Len=0 TSval=353568735 TSecr=50740
339,3.964372,192.168.1.181,192.168.1.108,TCP,1514,[TCP segment of a reassembled PDU]
340,3.965454,192.168.1.181,192.168.1.108,HTTP/XML,309,NOTIFY /upnp/eventing/lhnzgxtbdf HTTP/1.1 
341,3.965535,192.168.1.108,192.168.1.181,TCP,66,2869 > 34180 [ACK] Seq=1 Ack=1692 Win=66560 Len=0 TSval=50742 TSecr=353568736
