"No.","Time","Source","Destination","Protocol","Length","Info"
"1","0.000000","192.168.1.108","45.56.79.127","TCP","62","57141 > 443 [SYN] Seq=0 Win=8192 Len=0 MSS=1460 SACK_PERM=1"
"2","0.009988","192.168.1.108","45.56.79.127","TCP","62","57140 > 443 [SYN] Seq=0 Win=8192 Len=0 MSS=1460 SACK_PERM=1"
"3","0.042999","54.225.155.188","192.168.1.108","TCP","60","443 > 54685 [ACK] Seq=1 Ack=1 Win=70 Len=0"
"4","0.548239","fe80::5034:59dc:7b1d:2e8c","fe80::423:3956:e3c5:5411","SSDP","456","HTTP/1.1 200 OK "
"5","1.001818","192.168.1.108","45.56.79.127","TCP","66","57144 > 443 [SYN] Seq=0 Win=8192 Len=0 MSS=1460 WS=4 SACK_PERM=1"
"6","1.001981","192.168.1.108","45.56.79.127","TCP","66","57145 > 443 [SYN] Seq=0 Win=8192 Len=0 MSS=1460 WS=4 SACK_PERM=1"
"7","1.149873","fe80::423:3956:e3c5:5411","fe80::5034:59dc:7b1d:2e8c","ICMPv6","86","Neighbor Solicitation for fe80::5034:59dc:7b1d:2e8c from 00:14:d1:1e:c2:4e"
"8","1.150154","fe80::5034:59dc:7b1d:2e8c","fe80::423:3956:e3c5:5411","ICMPv6","86","Neighbor Advertisement fe80::5034:59dc:7b1d:2e8c (sol, ovr) is at 50:e5:49:eb:48:7e"
"9","1.455525","fe80::5034:59dc:7b1d:2e8c","ff02::c","SSDP","208","M-SEARCH * HTTP/1.1 "
"10","1.456299","fe80::5034:59dc:7b1d:2e8c","fe80::423:3956:e3c5:5411","pnrp","158","PNRP SOLICIT Message "
"11","1.456675","fe80::5034:59dc:7b1d:2e8c","ff02::1:ff9d:d0e1","ICMPv6","86","Neighbor Solicitation for fe80::843a:ae68:209d:d0e1 from 50:e5:49:eb:48:7e"
"12","1.456810","fe80::423:3956:e3c5:5411","fe80::5034:59dc:7b1d:2e8c","pnrp","182","PNRP ADVERTISE Message "
"13","1.456948","fe80::5034:59dc:7b1d:2e8c","fe80::423:3956:e3c5:5411","pnrp","170","PNRP REQUEST Message "
"14","1.457249","fe80::423:3956:e3c5:5411","fe80::5034:59dc:7b1d:2e8c","pnrp","82","PNRP ACK Message "
"15","1.457349","fe80::423:3956:e3c5:5411","fe80::5034:59dc:7b1d:2e8c","pnrp","190","PNRP FLOOD Message "
"16","1.457350","fe80::423:3956:e3c5:5411","fe80::5034:59dc:7b1d:2e8c","pnrp","190","PNRP FLOOD Message "
"17","1.758236","192.168.1.181","192.168.1.255","UDP","60","Source port: 38045  Destination port: 50000"
"18","1.789664","fe80::423:3956:e3c5:5411","fe80::5034:59dc:7b1d:2e8c","SSDP","453","HTTP/1.1 200 OK "
"19","2.014198","192.168.1.108","173.194.115.35","QUIC","305","CID: 16684433994042422170, Seq: 44"
"20","2.014274","192.168.1.108","173.194.115.35","QUIC","1392","CID: 16684433994042422170, Seq: 45"
"21","2.014512","192.168.1.108","173.194.115.35","QUIC","1392","CID: 16684433994042422170, Seq: 46"
"22","2.014721","192.168.1.108","173.194.115.35","QUIC","1392","CID: 16684433994042422170, Seq: 47"
"23","2.014905","192.168.1.108","173.194.115.35","QUIC","880","CID: 16684433994042422170, Seq: 48"
"24","2.033056","192.168.1.108","45.56.79.127","TCP","62","57143 > 443 [SYN] Seq=0 Win=8192 Len=0 MSS=1460 SACK_PERM=1"
"25","2.045169","173.194.115.35","192.168.1.108","QUIC","78","CID: 0, Seq: 76"
"26","2.046037","173.194.115.35","192.168.1.108","QUIC","75","CID: 0, Seq: 77"
"27","2.053603","173.194.115.35","192.168.1.108","QUIC","117","CID: 0, Seq: 78"
"28","2.053862","173.194.115.35","192.168.1.108","QUIC","1392","CID: 0, Seq: 79"
"29","2.053956","192.168.1.108","173.194.115.35","QUIC","89","CID: 16684433994042422170, Seq: 49"
"30","2.054080","173.194.115.35","192.168.1.108","QUIC","1392","CID: 0, Seq: 80"
"31","2.054081","173.194.115.35","192.168.1.108","QUIC","1392","CID: 0, Seq: 81"
"32","2.054151","173.194.115.35","192.168.1.108","QUIC","715","CID: 0, Seq: 82"
"33","2.054233","192.168.1.108","173.194.115.35","QUIC","83","CID: 16684433994042422170, Seq: 50"
"34","2.055915","192.168.1.108","173.194.115.35","QUIC","320","CID: 16684433994042422170, Seq: 51"
"35","2.055987","192.168.1.108","173.194.115.35","QUIC","1392","CID: 16684433994042422170, Seq: 52"
"36","2.056174","192.168.1.108","173.194.115.35","QUIC","1392","CID: 16684433994042422170, Seq: 53"
"37","2.056415","192.168.1.108","173.194.115.35","QUIC","1392","CID: 16684433994042422170, Seq: 54"
"38","2.056588","192.168.1.108","173.194.115.35","QUIC","1392","CID: 16684433994042422170, Seq: 55"
"39","2.056780","192.168.1.108","173.194.115.35","QUIC","810","CID: 16684433994042422170, Seq: 56"
"40","2.082648","173.194.115.35","192.168.1.108","QUIC","81","CID: 0, Seq: 83"
"41","2.083034","173.194.115.35","192.168.1.108","QUIC","75","CID: 0, Seq: 84"
"42","2.083071","173.194.115.35","192.168.1.108","QUIC","75","CID: 0, Seq: 85"
"43","2.185004","fe80::5034:59dc:7b1d:2e8c","fe80::423:3956:e3c5:5411","ICMPv6","86","Neighbor Solicitation for fe80::423:3956:e3c5:5411 from 50:e5:49:eb:48:7e"
"44","2.185039","fe80::5034:59dc:7b1d:2e8c","ff02::1:ff9d:d0e1","ICMPv6","86","Neighbor Solicitation for fe80::843a:ae68:209d:d0e1 from 50:e5:49:eb:48:7e"
"45","2.185537","fe80::423:3956:e3c5:5411","fe80::5034:59dc:7b1d:2e8c","ICMPv6","86","Neighbor Advertisement fe80::423:3956:e3c5:5411 (sol, ovr) is at 00:14:d1:1e:c2:4e"
"46","2.195875","173.194.115.35","192.168.1.108","QUIC","90","CID: 0, Seq: 86"
"47","2.196246","173.194.115.35","192.168.1.108","QUIC","612","CID: 0, Seq: 87"
"48","2.196592","192.168.1.108","173.194.115.35","QUIC","92","CID: 16684433994042422170, Seq: 57"
"49","2.258158","fe80::423:3956:e3c5:5411","ff02::c","SSDP","208","M-SEARCH * HTTP/1.1 "
"50","2.260115","fe80::423:3956:e3c5:5411","fe80::5034:59dc:7b1d:2e8c","pnrp","158","PNRP SOLICIT Message "
"51","2.260309","fe80::5034:59dc:7b1d:2e8c","fe80::423:3956:e3c5:5411","pnrp","182","PNRP ADVERTISE Message "
"52","2.260808","fe80::423:3956:e3c5:5411","ff02::1:ff9d:d0e1","ICMPv6","86","Neighbor Solicitation for fe80::843a:ae68:209d:d0e1 from 00:14:d1:1e:c2:4e"
"53","2.260812","fe80::423:3956:e3c5:5411","fe80::5034:59dc:7b1d:2e8c","pnrp","170","PNRP REQUEST Message "
"54","2.261004","fe80::5034:59dc:7b1d:2e8c","fe80::423:3956:e3c5:5411","pnrp","82","PNRP ACK Message "
"55","2.261088","fe80::5034:59dc:7b1d:2e8c","fe80::423:3956:e3c5:5411","pnrp","190","PNRP FLOOD Message "
"56","2.261149","fe80::5034:59dc:7b1d:2e8c","fe80::423:3956:e3c5:5411","pnrp","190","PNRP FLOOD Message "
"57","3.146640","fe80::423:3956:e3c5:5411","ff02::1:ff9d:d0e1","ICMPv6","86","Neighbor Solicitation for fe80::843a:ae68:209d:d0e1 from 00:14:d1:1e:c2:4e"
"58","3.185020","fe80::5034:59dc:7b1d:2e8c","ff02::1:ff9d:d0e1","ICMPv6","86","Neighbor Solicitation for fe80::843a:ae68:209d:d0e1 from 50:e5:49:eb:48:7e"
"59","3.562638","fe80::5034:59dc:7b1d:2e8c","fe80::423:3956:e3c5:5411","pnrp","248","PNRP LOOKUP Message "
"60","3.563227","fe80::423:3956:e3c5:5411","fe80::5034:59dc:7b1d:2e8c","pnrp","96","PNRP AUTHORITY Message "
"61","3.566069","fe80::5034:59dc:7b1d:2e8c","fe80::423:3956:e3c5:5411","pnrp","248","PNRP LOOKUP Message "
"62","3.566369","fe80::423:3956:e3c5:5411","fe80::5034:59dc:7b1d:2e8c","pnrp","96","PNRP AUTHORITY Message "
"63","3.566509","fe80::5034:59dc:7b1d:2e8c","fe80::423:3956:e3c5:5411","pnrp","248","PNRP LOOKUP Message "
"64","3.566793","fe80::423:3956:e3c5:5411","fe80::5034:59dc:7b1d:2e8c","pnrp","96","PNRP AUTHORITY Message "
"65","3.566919","fe80::5034:59dc:7b1d:2e8c","fe80::423:3956:e3c5:5411","pnrp","248","PNRP LOOKUP Message "
"66","3.567204","fe80::423:3956:e3c5:5411","fe80::5034:59dc:7b1d:2e8c","pnrp","96","PNRP AUTHORITY Message "
"67","3.997011","192.168.1.108","45.56.79.127","TCP","66","[TCP Retransmission] 57144 > 443 [SYN] Seq=0 Win=8192 Len=0 MSS=1460 WS=4 SACK_PERM=1"
"68","3.997011","192.168.1.108","45.56.79.127","TCP","66","[TCP Retransmission] 57145 > 443 [SYN] Seq=0 Win=8192 Len=0 MSS=1460 WS=4 SACK_PERM=1"
"69","4.145151","fe80::423:3956:e3c5:5411","ff02::1:ff9d:d0e1","ICMPv6","86","Neighbor Solicitation for fe80::843a:ae68:209d:d0e1 from 00:14:d1:1e:c2:4e"
"70","4.456327","fe80::5034:59dc:7b1d:2e8c","ff02::c","SSDP","208","M-SEARCH * HTTP/1.1 "
"71","4.537269","fe80::5034:59dc:7b1d:2e8c","fe80::423:3956:e3c5:5411","SSDP","456","HTTP/1.1 200 OK "
"72","4.571774","192.168.1.181","192.168.1.108","TCP","74","59362 > 2869 [SYN] Seq=0 Win=14600 Len=0 MSS=1460 SACK_PERM=1 TSval=354374917 TSecr=0 WS=2"
"73","4.572001","192.168.1.108","192.168.1.181","TCP","74","2869 > 59362 [SYN, ACK] Seq=0 Ack=1 Win=8192 Len=0 MSS=1460 WS=256 SACK_PERM=1 TSval=854658 TSecr=354374917"
"74","4.573765","192.168.1.181","192.168.1.108","TCP","66","59362 > 2869 [ACK] Seq=1 Ack=1 Win=14600 Len=0 TSval=354374917 TSecr=854658"
"75","4.589351","192.168.1.181","192.168.1.108","TCP","1514","[TCP segment of a reassembled PDU]"
"76","4.590398","192.168.1.181","192.168.1.108","HTTP/XML","309","NOTIFY /upnp/eventing/ipooptopyk HTTP/1.1 "
"77","4.590478","192.168.1.108","192.168.1.181","TCP","66","2869 > 59362 [ACK] Seq=1 Ack=1692 Win=66560 Len=0 TSval=854660 TSecr=354374919"
"78","4.590603","192.168.1.108","192.168.1.181","HTTP","191","HTTP/1.1 200 OK "
"79","4.593032","192.168.1.181","192.168.1.108","TCP","66","59362 > 2869 [ACK] Seq=1692 Ack=126 Win=14600 Len=0 TSval=354374919 TSecr=854660"
"80","4.593090","192.168.1.108","192.168.1.181","TCP","66","2869 > 59362 [FIN, ACK] Seq=126 Ack=1692 Win=66560 Len=0 TSval=854660 TSecr=354374919"
"81","4.596972","192.168.1.181","192.168.1.108","TCP","66","59362 > 2869 [FIN, ACK] Seq=1692 Ack=127 Win=14600 Len=0 TSval=354374919 TSecr=854660"
"82","4.597028","192.168.1.108","192.168.1.181","TCP","66","2869 > 59362 [ACK] Seq=127 Ack=1693 Win=66560 Len=0 TSval=854661 TSecr=354374919"
"83","4.640975","192.168.1.181","192.168.1.108","TCP","74","59363 > 2869 [SYN] Seq=0 Win=14600 Len=0 MSS=1460 SACK_PERM=1 TSval=354374924 TSecr=0 WS=2"
"84","4.641214","192.168.1.108","192.168.1.181","TCP","74","2869 > 59363 [SYN, ACK] Seq=0 Ack=1 Win=8192 Len=0 MSS=1460 WS=256 SACK_PERM=1 TSval=854665 TSecr=354374924"
"85","4.642957","192.168.1.181","192.168.1.108","TCP","66","59363 > 2869 [ACK] Seq=1 Ack=1 Win=14600 Len=0 TSval=354374924 TSecr=854665"
"86","4.646848","192.168.1.181","192.168.1.108","TCP","1514","[TCP segment of a reassembled PDU]"
"87","4.650276","192.168.1.181","192.168.1.108","HTTP/XML","309","NOTIFY /upnp/eventing/ljafbkswid HTTP/1.1 "
"88","4.650337","192.168.1.108","192.168.1.181","TCP","66","2869 > 59363 [ACK] Seq=1 Ack=1692 Win=66560 Len=0 TSval=854666 TSecr=354374924"
"89","4.650475","192.168.1.108","192.168.1.181","HTTP","191","HTTP/1.1 200 OK "
"90","4.652937","192.168.1.181","192.168.1.108","TCP","66","59363 > 2869 [ACK] Seq=1692 Ack=126 Win=14600 Len=0 TSval=354374925 TSecr=854666"
"91","4.652986","192.168.1.108","192.168.1.181","TCP","66","2869 > 59363 [FIN, ACK] Seq=126 Ack=1692 Win=66560 Len=0 TSval=854666 TSecr=354374925"
"92","4.656926","192.168.1.181","192.168.1.108","TCP","66","59363 > 2869 [FIN, ACK] Seq=1692 Ack=127 Win=14600 Len=0 TSval=354374925 TSecr=854666"
"93","4.656977","192.168.1.108","192.168.1.181","TCP","66","2869 > 59363 [ACK] Seq=127 Ack=1693 Win=66560 Len=0 TSval=854667 TSecr=354374925"
"94","4.720991","192.168.1.181","192.168.1.108","TCP","74","59364 > 2869 [SYN] Seq=0 Win=14600 Len=0 MSS=1460 SACK_PERM=1 TSval=354374932 TSecr=0 WS=2"
"95","4.721215","192.168.1.108","192.168.1.181","TCP","74","2869 > 59364 [SYN, ACK] Seq=0 Ack=1 Win=8192 Len=0 MSS=1460 WS=256 SACK_PERM=1 TSval=854673 TSecr=354374932"
"96","4.722963","192.168.1.181","192.168.1.108","TCP","66","59364 > 2869 [ACK] Seq=1 Ack=1 Win=14600 Len=0 TSval=354374932 TSecr=854673"
"97","4.726889","192.168.1.181","192.168.1.108","TCP","1514","[TCP segment of a reassembled PDU]"
"98","4.740689","192.168.1.181","192.168.1.108","TCP","74","59365 > 2869 [SYN] Seq=0 Win=14600 Len=0 MSS=1460 SACK_PERM=1 TSval=354374934 TSecr=0 WS=2"
"99","4.740814","192.168.1.108","192.168.1.181","TCP","74","2869 > 59365 [SYN, ACK] Seq=0 Ack=1 Win=8192 Len=0 MSS=1460 WS=256 SACK_PERM=1 TSval=854675 TSecr=354374934"
"100","4.742553","192.168.1.181","192.168.1.108","TCP","66","59365 > 2869 [ACK] Seq=1 Ack=1 Win=14600 Len=0 TSval=354374934 TSecr=854675"
"101","4.746521","192.168.1.181","192.168.1.108","TCP","1514","[TCP segment of a reassembled PDU]"
"102","4.768318","192.168.1.181","192.168.1.108","HTTP/XML","309","NOTIFY /upnp/eventing/flviknqdow HTTP/1.1 "
"103","4.768391","192.168.1.108","192.168.1.181","TCP","66","2869 > 59364 [ACK] Seq=1 Ack=1692 Win=66560 Len=0 TSval=854678 TSecr=354374932"
"104","4.768616","192.168.1.108","192.168.1.181","HTTP","191","HTTP/1.1 200 OK "
"105","4.770899","192.168.1.181","192.168.1.108","TCP","66","59364 > 2869 [ACK] Seq=1692 Ack=126 Win=14600 Len=0 TSval=354374937 TSecr=854678"
"106","4.770953","192.168.1.108","192.168.1.181","TCP","66","2869 > 59364 [FIN, ACK] Seq=126 Ack=1692 Win=66560 Len=0 TSval=854678 TSecr=354374937"
"107","4.774963","192.168.1.181","192.168.1.108","TCP","66","59364 > 2869 [FIN, ACK] Seq=1692 Ack=127 Win=14600 Len=0 TSval=354374937 TSecr=854678"
"108","4.775012","192.168.1.108","192.168.1.181","TCP","66","2869 > 59364 [ACK] Seq=127 Ack=1693 Win=66560 Len=0 TSval=854678 TSecr=354374937"
"109","4.778883","192.168.1.181","192.168.1.108","HTTP/XML","309","NOTIFY /upnp/eventing/gthfbhpsji HTTP/1.1 "
"110","4.778949","192.168.1.108","192.168.1.181","TCP","66","2869 > 59365 [ACK] Seq=1 Ack=1692 Win=66560 Len=0 TSval=854679 TSecr=354374934"
"111","4.779091","192.168.1.108","192.168.1.181","HTTP","191","HTTP/1.1 200 OK "
"112","4.781551","192.168.1.181","192.168.1.108","TCP","66","59365 > 2869 [ACK] Seq=1692 Ack=126 Win=14600 Len=0 TSval=354374938 TSecr=854679"
"113","4.781597","192.168.1.108","192.168.1.181","TCP","66","2869 > 59365 [FIN, ACK] Seq=126 Ack=1692 Win=66560 Len=0 TSval=854679 TSecr=354374938"
"114","4.785654","192.168.1.181","192.168.1.108","TCP","66","59365 > 2869 [FIN, ACK] Seq=1692 Ack=127 Win=14600 Len=0 TSval=354374938 TSecr=854679"
"115","4.785705","192.168.1.108","192.168.1.181","TCP","66","2869 > 59365 [ACK] Seq=127 Ack=1693 Win=66560 Len=0 TSval=854679 TSecr=354374938"
"116","4.789515","192.168.1.181","192.168.1.108","TCP","74","59366 > 2869 [SYN] Seq=0 Win=14600 Len=0 MSS=1460 SACK_PERM=1 TSval=354374939 TSecr=0 WS=2"
"117","4.789727","192.168.1.108","192.168.1.181","TCP","74","2869 > 59366 [SYN, ACK] Seq=0 Ack=1 Win=8192 Len=0 MSS=1460 WS=256 SACK_PERM=1 TSval=854680 TSecr=354374939"
"118","4.791450","192.168.1.181","192.168.1.108","TCP","66","59366 > 2869 [ACK] Seq=1 Ack=1 Win=14600 Len=0 TSval=354374939 TSecr=854680"
"119","4.795333","192.168.1.181","192.168.1.108","TCP","1514","[TCP segment of a reassembled PDU]"
"120","4.796368","192.168.1.181","192.168.1.108","HTTP/XML","308","NOTIFY /upnp/eventing/iflubpdnqe HTTP/1.1 "
"121","4.796387","192.168.1.108","192.168.1.181","TCP","66","2869 > 59366 [ACK] Seq=1 Ack=1691 Win=66560 Len=0 TSval=854680 TSecr=354374939"
"122","4.796437","192.168.1.108","192.168.1.181","HTTP","191","HTTP/1.1 200 OK "
"123","4.799070","192.168.1.181","192.168.1.108","TCP","66","59366 > 2869 [ACK] Seq=1691 Ack=126 Win=14600 Len=0 TSval=354374940 TSecr=854680"
"124","4.799117","192.168.1.108","192.168.1.181","TCP","66","2869 > 59366 [FIN, ACK] Seq=126 Ack=1691 Win=66560 Len=0 TSval=854681 TSecr=354374940"
"125","4.803617","192.168.1.108","255.255.255.255","DB-LSP-DISC","157","Dropbox LAN sync Discovery Protocol"
"126","4.804280","192.168.1.108","192.168.1.255","DB-LSP-DISC","157","Dropbox LAN sync Discovery Protocol"
"127","4.812143","192.168.1.181","192.168.1.108","TCP","66","59366 > 2869 [FIN, ACK] Seq=1691 Ack=127 Win=14600 Len=0 TSval=354374941 TSecr=854681"
"128","4.812176","192.168.1.108","192.168.1.181","TCP","66","2869 > 59366 [ACK] Seq=127 Ack=1692 Win=66560 Len=0 TSval=854682 TSecr=354374941"
"129","4.827088","192.168.1.181","192.168.1.108","TCP","74","59367 > 2869 [SYN] Seq=0 Win=14600 Len=0 MSS=1460 SACK_PERM=1 TSval=354374942 TSecr=0 WS=2"
"130","4.827236","192.168.1.108","192.168.1.181","TCP","74","2869 > 59367 [SYN, ACK] Seq=0 Ack=1 Win=8192 Len=0 MSS=1460 WS=256 SACK_PERM=1 TSval=854684 TSecr=354374942"
"131","4.829022","192.168.1.181","192.168.1.108","TCP","66","59367 > 2869 [ACK] Seq=1 Ack=1 Win=14600 Len=0 TSval=354374943 TSecr=854684"
"132","4.833349","192.168.1.181","192.168.1.108","TCP","74","59368 > 2869 [SYN] Seq=0 Win=14600 Len=0 MSS=1460 SACK_PERM=1 TSval=354374943 TSecr=0 WS=2"
"133","4.833399","192.168.1.108","192.168.1.181","TCP","74","2869 > 59368 [SYN, ACK] Seq=0 Ack=1 Win=8192 Len=0 MSS=1460 WS=256 SACK_PERM=1 TSval=854684 TSecr=354374943"
"134","4.835142","192.168.1.181","192.168.1.108","TCP","66","59368 > 2869 [ACK] Seq=1 Ack=1 Win=14600 Len=0 TSval=354374943 TSecr=854684"
"135","4.849423","192.168.1.181","192.168.1.108","TCP","74","59369 > 2869 [SYN] Seq=0 Win=14600 Len=0 MSS=1460 SACK_PERM=1 TSval=354374945 TSecr=0 WS=2"
"136","4.849560","192.168.1.108","192.168.1.181","TCP","74","2869 > 59369 [SYN, ACK] Seq=0 Ack=1 Win=8192 Len=0 MSS=1460 WS=256 SACK_PERM=1 TSval=854686 TSecr=354374945"
"137","4.851307","192.168.1.181","192.168.1.108","TCP","66","59369 > 2869 [ACK] Seq=1 Ack=1 Win=14600 Len=0 TSval=354374945 TSecr=854686"
"138","4.855350","192.168.1.181","192.168.1.108","TCP","1514","[TCP segment of a reassembled PDU]"
"139","4.856399","192.168.1.181","192.168.1.108","HTTP/XML","307","NOTIFY /upnp/eventing/ncizuaprez HTTP/1.1 "
"140","4.856482","192.168.1.108","192.168.1.181","TCP","66","2869 > 59369 [ACK] Seq=1 Ack=1690 Win=66560 Len=0 TSval=854686 TSecr=354374945"
"141","4.856590","192.168.1.108","192.168.1.181","HTTP","191","HTTP/1.1 200 OK "
"142","4.859197","192.168.1.181","192.168.1.108","TCP","66","59369 > 2869 [ACK] Seq=1690 Ack=126 Win=14600 Len=0 TSval=354374946 TSecr=854686"
"143","4.859229","192.168.1.108","192.168.1.181","TCP","66","2869 > 59369 [FIN, ACK] Seq=126 Ack=1690 Win=66560 Len=0 TSval=854687 TSecr=354374946"
"144","4.863522","192.168.1.181","192.168.1.108","TCP","1514","[TCP segment of a reassembled PDU]"
"145","4.864575","192.168.1.181","192.168.1.108","HTTP/XML","309","NOTIFY /upnp/eventing/ljafbkswid HTTP/1.1 "
"146","4.864595","192.168.1.108","192.168.1.181","TCP","66","2869 > 59368 [ACK] Seq=1 Ack=1692 Win=66560 Len=0 TSval=854687 TSecr=354374946"
"147","4.864644","192.168.1.108","192.168.1.181","HTTP","191","HTTP/1.1 200 OK "
"148","4.867336","192.168.1.181","192.168.1.108","TCP","66","59368 > 2869 [ACK] Seq=1692 Ack=126 Win=14600 Len=0 TSval=354374947 TSecr=854687"
"149","4.867352","192.168.1.108","192.168.1.181","TCP","66","2869 > 59368 [FIN, ACK] Seq=126 Ack=1692 Win=66560 Len=0 TSval=854688 TSecr=354374947"
"150","4.872736","192.168.1.181","192.168.1.108","TCP","1514","[TCP segment of a reassembled PDU]"
"151","4.873792","192.168.1.181","192.168.1.108","HTTP/XML","309","NOTIFY /upnp/eventing/ipooptopyk HTTP/1.1 "
"152","4.873850","192.168.1.108","192.168.1.181","TCP","66","2869 > 59367 [ACK] Seq=1 Ack=1692 Win=66560 Len=0 TSval=854688 TSecr=354374947"
"153","4.873945","192.168.1.108","192.168.1.181","HTTP","191","HTTP/1.1 200 OK "
"154","4.876266","192.168.1.181","192.168.1.108","TCP","66","59367 > 2869 [ACK] Seq=1692 Ack=126 Win=14600 Len=0 TSval=354374947 TSecr=854688"
"155","4.876311","192.168.1.108","192.168.1.181","TCP","66","2869 > 59367 [FIN, ACK] Seq=126 Ack=1692 Win=66560 Len=0 TSval=854688 TSecr=354374947"
"156","4.889504","192.168.1.181","192.168.1.108","TCP","66","59369 > 2869 [FIN, ACK] Seq=1690 Ack=127 Win=14600 Len=0 TSval=354374949 TSecr=854687"
"157","4.889563","192.168.1.108","192.168.1.181","TCP","66","2869 > 59369 [ACK] Seq=127 Ack=1691 Win=66560 Len=0 TSval=854690 TSecr=354374949"
"158","4.895430","192.168.1.181","192.168.1.108","TCP","74","59370 > 2869 [SYN] Seq=0 Win=14600 Len=0 MSS=1460 SACK_PERM=1 TSval=354374949 TSecr=0 WS=2"
"159","4.895557","192.168.1.108","192.168.1.181","TCP","74","2869 > 59370 [SYN, ACK] Seq=0 Ack=1 Win=8192 Len=0 MSS=1460 WS=256 SACK_PERM=1 TSval=854690 TSecr=354374949"
"160","4.897588","192.168.1.181","192.168.1.108","TCP","66","59370 > 2869 [ACK] Seq=1 Ack=1 Win=14600 Len=0 TSval=354374950 TSecr=854690"
"161","4.900907","192.168.1.181","192.168.1.108","TCP","66","59368 > 2869 [FIN, ACK] Seq=1692 Ack=127 Win=14600 Len=0 TSval=354374950 TSecr=854688"
"162","4.900968","192.168.1.108","192.168.1.181","TCP","66","2869 > 59368 [ACK] Seq=127 Ack=1693 Win=66560 Len=0 TSval=854691 TSecr=354374950"
"163","4.906421","192.168.1.181","192.168.1.108","TCP","74","59371 > 2869 [SYN] Seq=0 Win=14600 Len=0 MSS=1460 SACK_PERM=1 TSval=354374950 TSecr=0 WS=2"
"164","4.906615","192.168.1.108","192.168.1.181","TCP","74","2869 > 59371 [SYN, ACK] Seq=0 Ack=1 Win=8192 Len=0 MSS=1460 WS=256 SACK_PERM=1 TSval=854691 TSecr=354374950"
"165","4.908629","192.168.1.181","192.168.1.108","TCP","66","59371 > 2869 [ACK] Seq=1 Ack=1 Win=14600 Len=0 TSval=354374951 TSecr=854691"
"166","4.920013","192.168.1.181","192.168.1.108","TCP","66","59367 > 2869 [FIN, ACK] Seq=1692 Ack=127 Win=14600 Len=0 TSval=354374951 TSecr=854688"
"167","4.920014","192.168.1.181","192.168.1.108","TCP","74","59372 > 2869 [SYN] Seq=0 Win=14600 Len=0 MSS=1460 SACK_PERM=1 TSval=354374951 TSecr=0 WS=2"
"168","4.920079","192.168.1.108","192.168.1.181","TCP","66","2869 > 59367 [ACK] Seq=127 Ack=1693 Win=66560 Len=0 TSval=854693 TSecr=354374951"
"169","4.920188","192.168.1.108","192.168.1.181","TCP","74","2869 > 59372 [SYN, ACK] Seq=0 Ack=1 Win=8192 Len=0 MSS=1460 WS=256 SACK_PERM=1 TSval=854693 TSecr=354374951"
"170","4.922892","192.168.1.181","192.168.1.108","TCP","66","59372 > 2869 [ACK] Seq=1 Ack=1 Win=14600 Len=0 TSval=354374952 TSecr=854693"
"171","4.923771","192.168.1.181","192.168.1.108","TCP","1514","[TCP segment of a reassembled PDU]"
"172","4.928448","192.168.1.181","192.168.1.108","HTTP/XML","309","NOTIFY /upnp/eventing/flviknqdow HTTP/1.1 "
"173","4.928471","192.168.1.108","192.168.1.181","TCP","66","2869 > 59370 [ACK] Seq=1 Ack=1692 Win=66560 Len=0 TSval=854694 TSecr=354374952"
"174","4.928527","192.168.1.108","192.168.1.181","HTTP","191","HTTP/1.1 200 OK "
"175","4.930919","192.168.1.181","192.168.1.108","TCP","66","59370 > 2869 [ACK] Seq=1692 Ack=126 Win=14600 Len=0 TSval=354374953 TSecr=854694"
"176","4.930946","192.168.1.108","192.168.1.181","TCP","66","2869 > 59370 [FIN, ACK] Seq=126 Ack=1692 Win=66560 Len=0 TSval=854694 TSecr=354374953"
"177","4.934912","192.168.1.181","192.168.1.108","TCP","66","59370 > 2869 [FIN, ACK] Seq=1692 Ack=127 Win=14600 Len=0 TSval=354374953 TSecr=854694"
"178","4.934966","192.168.1.108","192.168.1.181","TCP","66","2869 > 59370 [ACK] Seq=127 Ack=1693 Win=66560 Len=0 TSval=854694 TSecr=354374953"
"179","4.940904","192.168.1.181","192.168.1.108","TCP","1514","[TCP segment of a reassembled PDU]"
"180","4.941980","192.168.1.181","192.168.1.108","HTTP/XML","309","NOTIFY /upnp/eventing/gthfbhpsji HTTP/1.1 "
"181","4.942036","192.168.1.108","192.168.1.181","TCP","66","2869 > 59371 [ACK] Seq=1 Ack=1692 Win=66560 Len=0 TSval=854695 TSecr=354374954"
"182","4.942170","192.168.1.108","192.168.1.181","HTTP","191","HTTP/1.1 200 OK "
"183","4.944598","192.168.1.181","192.168.1.108","TCP","66","59371 > 2869 [ACK] Seq=1692 Ack=126 Win=14600 Len=0 TSval=354374954 TSecr=854695"
"184","4.944642","192.168.1.108","192.168.1.181","TCP","66","2869 > 59371 [FIN, ACK] Seq=126 Ack=1692 Win=66560 Len=0 TSval=854695 TSecr=354374954"
"185","4.948217","192.168.1.181","192.168.1.108","TCP","1514","[TCP segment of a reassembled PDU]"
"186","4.949277","192.168.1.181","192.168.1.108","HTTP/XML","308","NOTIFY /upnp/eventing/iflubpdnqe HTTP/1.1 "
"187","4.949336","192.168.1.108","192.168.1.181","TCP","66","2869 > 59372 [ACK] Seq=1 Ack=1691 Win=66560 Len=0 TSval=854696 TSecr=354374955"
"188","4.949458","192.168.1.108","192.168.1.181","HTTP","191","HTTP/1.1 200 OK "
"189","4.951923","192.168.1.181","192.168.1.108","TCP","66","59372 > 2869 [ACK] Seq=1691 Ack=126 Win=14600 Len=0 TSval=354374955 TSecr=854696"
"190","4.951962","192.168.1.108","192.168.1.181","TCP","66","2869 > 59372 [FIN, ACK] Seq=126 Ack=1691 Win=66560 Len=0 TSval=854696 TSecr=354374955"
"191","4.955893","192.168.1.181","192.168.1.108","TCP","66","59372 > 2869 [FIN, ACK] Seq=1691 Ack=127 Win=14600 Len=0 TSval=354374955 TSecr=854696"
"192","4.955936","192.168.1.108","192.168.1.181","TCP","66","2869 > 59372 [ACK] Seq=127 Ack=1692 Win=66560 Len=0 TSval=854696 TSecr=354374955"
"193","4.971107","192.168.1.181","192.168.1.108","TCP","74","59373 > 2869 [SYN] Seq=0 Win=14600 Len=0 MSS=1460 SACK_PERM=1 TSval=354374957 TSecr=0 WS=2"
"194","4.971345","192.168.1.108","192.168.1.181","TCP","74","2869 > 59373 [SYN, ACK] Seq=0 Ack=1 Win=8192 Len=0 MSS=1460 WS=256 SACK_PERM=1 TSval=854698 TSecr=354374957"
"195","4.973148","192.168.1.181","192.168.1.108","TCP","66","59373 > 2869 [ACK] Seq=1 Ack=1 Win=14600 Len=0 TSval=354374957 TSecr=854698"
"196","4.977080","192.168.1.181","192.168.1.108","TCP","66","59371 > 2869 [ACK] Seq=1692 Ack=127 Win=14600 Len=0 TSval=354374958 TSecr=854695"
"197","4.977906","192.168.1.181","192.168.1.108","TCP","1514","[TCP segment of a reassembled PDU]"
"198","4.989455","192.168.1.181","192.168.1.108","TCP","66","59371 > 2869 [FIN, ACK] Seq=1692 Ack=127 Win=14600 Len=0 TSval=354374959 TSecr=854695"
"199","4.989508","192.168.1.108","192.168.1.181","TCP","66","2869 > 59371 [ACK] Seq=127 Ack=1693 Win=66560 Len=0 TSval=854700 TSecr=354374959"
"200","4.996020","192.168.1.181","192.168.1.108","TCP","74","59374 > 2869 [SYN] Seq=0 Win=14600 Len=0 MSS=1460 SACK_PERM=1 TSval=354374959 TSecr=0 WS=2"
"201","4.996190","192.168.1.108","192.168.1.181","TCP","74","2869 > 59374 [SYN, ACK] Seq=0 Ack=1 Win=8192 Len=0 MSS=1460 WS=256 SACK_PERM=1 TSval=854700 TSecr=354374959"
"202","4.998592","192.168.1.181","192.168.1.108","TCP","66","59374 > 2869 [ACK] Seq=1 Ack=1 Win=14600 Len=0 TSval=354374960 TSecr=854700"
"203","5.003476","192.168.1.181","192.168.1.108","HTTP/XML","307","NOTIFY /upnp/eventing/ncizuaprez HTTP/1.1 "
"204","5.003533","192.168.1.108","192.168.1.181","TCP","66","2869 > 59373 [ACK] Seq=1 Ack=1690 Win=66560 Len=0 TSval=854701 TSecr=354374958"
"205","5.003610","192.168.1.108","192.168.1.181","HTTP","191","HTTP/1.1 200 OK "
"206","5.005904","192.168.1.181","192.168.1.108","TCP","66","59373 > 2869 [ACK] Seq=1690 Ack=126 Win=14600 Len=0 TSval=354374960 TSecr=854701"
"207","5.005924","192.168.1.108","192.168.1.181","TCP","66","2869 > 59373 [FIN, ACK] Seq=126 Ack=1690 Win=66560 Len=0 TSval=854701 TSecr=354374960"
"208","5.021235","192.168.1.181","192.168.1.108","TCP","1514","[TCP segment of a reassembled PDU]"
"209","5.022313","192.168.1.181","192.168.1.108","HTTP/XML","313","NOTIFY /upnp/eventing/ipooptopyk HTTP/1.1 "
"210","5.022374","192.168.1.108","192.168.1.181","TCP","66","2869 > 59374 [ACK] Seq=1 Ack=1696 Win=66560 Len=0 TSval=854703 TSecr=354374962"
"211","5.022540","192.168.1.108","192.168.1.181","HTTP","191","HTTP/1.1 200 OK "
"212","5.024976","192.168.1.181","192.168.1.108","TCP","66","59374 > 2869 [ACK] Seq=1696 Ack=126 Win=14600 Len=0 TSval=354374962 TSecr=854703"
"213","5.025022","192.168.1.108","192.168.1.181","TCP","66","2869 > 59374 [FIN, ACK] Seq=126 Ack=1696 Win=66560 Len=0 TSval=854703 TSecr=354374962"
"214","5.040327","192.168.1.181","192.168.1.108","TCP","74","59375 > 2869 [SYN] Seq=0 Win=14600 Len=0 MSS=1460 SACK_PERM=1 TSval=354374964 TSecr=0 WS=2"
"215","5.040540","192.168.1.108","192.168.1.181","TCP","74","2869 > 59375 [SYN, ACK] Seq=0 Ack=1 Win=8192 Len=0 MSS=1460 WS=256 SACK_PERM=1 TSval=854705 TSecr=354374964"
"216","5.042299","192.168.1.181","192.168.1.108","TCP","66","59375 > 2869 [ACK] Seq=1 Ack=1 Win=14600 Len=0 TSval=354374964 TSecr=854705"
"217","5.046235","192.168.1.181","192.168.1.108","TCP","1514","[TCP segment of a reassembled PDU]"
"218","5.046760","192.168.1.181","192.168.1.108","TCP","66","59373 > 2869 [ACK] Seq=1690 Ack=127 Win=14600 Len=0 TSval=354374965 TSecr=854701"
"219","5.049531","192.168.1.181","192.168.1.108","TCP","66","59373 > 2869 [FIN, ACK] Seq=1690 Ack=127 Win=14600 Len=0 TSval=354374965 TSecr=854701"
"220","5.049579","192.168.1.108","192.168.1.181","TCP","66","2869 > 59373 [ACK] Seq=127 Ack=1691 Win=66560 Len=0 TSval=854706 TSecr=354374965"
"221","5.055408","192.168.1.181","192.168.1.108","TCP","74","59376 > 2869 [SYN] Seq=0 Win=14600 Len=0 MSS=1460 SACK_PERM=1 TSval=354374965 TSecr=0 WS=2"
"222","5.055532","192.168.1.108","192.168.1.181","TCP","74","2869 > 59376 [SYN, ACK] Seq=0 Ack=1 Win=8192 Len=0 MSS=1460 WS=256 SACK_PERM=1 TSval=854706 TSecr=354374965"
"223","5.057559","192.168.1.181","192.168.1.108","TCP","66","59376 > 2869 [ACK] Seq=1 Ack=1 Win=14600 Len=0 TSval=354374966 TSecr=854706"
"224","5.067194","192.168.1.181","192.168.1.108","TCP","66","59374 > 2869 [ACK] Seq=1696 Ack=127 Win=14600 Len=0 TSval=354374967 TSecr=854703"
"225","5.070208","192.168.1.181","192.168.1.108","TCP","66","59374 > 2869 [FIN, ACK] Seq=1696 Ack=127 Win=14600 Len=0 TSval=354374967 TSecr=854703"
"226","5.070265","192.168.1.108","192.168.1.181","TCP","66","2869 > 59374 [ACK] Seq=127 Ack=1697 Win=66560 Len=0 TSval=854708 TSecr=354374967"
"227","5.075580","192.168.1.181","192.168.1.108","TCP","74","59377 > 2869 [SYN] Seq=0 Win=14600 Len=0 MSS=1460 SACK_PERM=1 TSval=354374967 TSecr=0 WS=2"
"228","5.075751","192.168.1.108","192.168.1.181","TCP","74","2869 > 59377 [SYN, ACK] Seq=0 Ack=1 Win=8192 Len=0 MSS=1460 WS=256 SACK_PERM=1 TSval=854708 TSecr=354374967"
"229","5.077879","192.168.1.181","192.168.1.108","TCP","66","59377 > 2869 [ACK] Seq=1 Ack=1 Win=14600 Len=0 TSval=354374968 TSecr=854708"
"230","5.087776","192.168.1.181","192.168.1.108","HTTP/XML","313","NOTIFY /upnp/eventing/ljafbkswid HTTP/1.1 "
"231","5.087825","192.168.1.108","192.168.1.181","TCP","66","2869 > 59375 [ACK] Seq=1 Ack=1696 Win=66560 Len=0 TSval=854710 TSecr=354374964"
"232","5.087902","192.168.1.108","192.168.1.181","HTTP","191","HTTP/1.1 200 OK "
"233","5.090151","192.168.1.181","192.168.1.108","TCP","66","59375 > 2869 [ACK] Seq=1696 Ack=126 Win=14600 Len=0 TSval=354374969 TSecr=854710"
"234","5.090171","192.168.1.108","192.168.1.181","TCP","66","2869 > 59375 [FIN, ACK] Seq=126 Ack=1696 Win=66560 Len=0 TSval=854710 TSecr=354374969"
"235","5.094279","192.168.1.181","192.168.1.108","TCP","66","59375 > 2869 [FIN, ACK] Seq=1696 Ack=127 Win=14600 Len=0 TSval=354374969 TSecr=854710"
"236","5.094304","192.168.1.108","192.168.1.181","TCP","66","2869 > 59375 [ACK] Seq=127 Ack=1697 Win=66560 Len=0 TSval=854710 TSecr=354374969"
"237","5.100625","192.168.1.181","192.168.1.108","TCP","1514","[TCP segment of a reassembled PDU]"
"238","5.101721","192.168.1.181","192.168.1.108","HTTP/XML","313","NOTIFY /upnp/eventing/flviknqdow HTTP/1.1 "
"239","5.101749","192.168.1.108","192.168.1.181","TCP","66","2869 > 59376 [ACK] Seq=1 Ack=1696 Win=66560 Len=0 TSval=854711 TSecr=354374970"
"240","5.101826","192.168.1.108","192.168.1.181","HTTP","191","HTTP/1.1 200 OK "
"241","5.105555","192.168.1.181","192.168.1.108","TCP","66","59376 > 2869 [ACK] Seq=1696 Ack=126 Win=14600 Len=0 TSval=354374970 TSecr=854711"
"242","5.105586","192.168.1.108","192.168.1.181","TCP","66","2869 > 59376 [FIN, ACK] Seq=126 Ack=1696 Win=66560 Len=0 TSval=854711 TSecr=354374970"
"243","5.120390","192.168.1.181","192.168.1.108","TCP","1514","[TCP segment of a reassembled PDU]"
"244","5.121462","192.168.1.181","192.168.1.108","HTTP/XML","313","NOTIFY /upnp/eventing/gthfbhpsji HTTP/1.1 "
"245","5.121489","192.168.1.108","192.168.1.181","TCP","66","2869 > 59377 [ACK] Seq=1 Ack=1696 Win=66560 Len=0 TSval=854713 TSecr=354374972"
"246","5.121566","192.168.1.108","192.168.1.181","HTTP","191","HTTP/1.1 200 OK "
"247","5.123823","192.168.1.181","192.168.1.108","TCP","66","59377 > 2869 [ACK] Seq=1696 Ack=126 Win=14600 Len=0 TSval=354374972 TSecr=854713"
"248","5.123872","192.168.1.108","192.168.1.181","TCP","66","2869 > 59377 [FIN, ACK] Seq=126 Ack=1696 Win=66560 Len=0 TSval=854713 TSecr=354374972"
"249","5.146437","192.168.1.181","192.168.1.108","TCP","66","59376 > 2869 [ACK] Seq=1696 Ack=127 Win=14600 Len=0 TSval=354374975 TSecr=854711"
"250","5.151991","192.168.1.181","192.168.1.108","TCP","74","59378 > 2869 [SYN] Seq=0 Win=14600 Len=0 MSS=1460 SACK_PERM=1 TSval=354374975 TSecr=0 WS=2"
"251","5.152178","192.168.1.108","192.168.1.181","TCP","74","2869 > 59378 [SYN, ACK] Seq=0 Ack=1 Win=8192 Len=0 MSS=1460 WS=256 SACK_PERM=1 TSval=854716 TSecr=354374975"
"252","5.154626","192.168.1.181","192.168.1.108","TCP","66","59378 > 2869 [ACK] Seq=1 Ack=1 Win=14600 Len=0 TSval=354374975 TSecr=854716"
"253","5.156578","192.168.1.181","192.168.1.108","TCP","66","59377 > 2869 [ACK] Seq=1696 Ack=127 Win=14600 Len=0 TSval=354374976 TSecr=854713"
"254","5.156919","192.168.1.181","192.168.1.108","TCP","66","59376 > 2869 [FIN, ACK] Seq=1696 Ack=127 Win=14600 Len=0 TSval=354374975 TSecr=854711"
"255","5.156955","192.168.1.108","192.168.1.181","TCP","66","2869 > 59376 [ACK] Seq=127 Ack=1697 Win=66560 Len=0 TSval=854717 TSecr=354374975"
"256","5.162168","192.168.1.181","192.168.1.108","TCP","1514","[TCP segment of a reassembled PDU]"
"257","5.163017","192.168.1.181","192.168.1.108","HTTP/XML","312","NOTIFY /upnp/eventing/iflubpdnqe HTTP/1.1 "
"258","5.163047","192.168.1.108","192.168.1.181","TCP","66","2869 > 59378 [ACK] Seq=1 Ack=1695 Win=66560 Len=0 TSval=854717 TSecr=354374976"
"259","5.163121","192.168.1.108","192.168.1.181","HTTP","191","HTTP/1.1 200 OK "
"260","5.165405","192.168.1.181","192.168.1.108","TCP","66","59378 > 2869 [ACK] Seq=1695 Ack=126 Win=14600 Len=0 TSval=354374976 TSecr=854717"
"261","5.165450","192.168.1.108","192.168.1.181","TCP","66","2869 > 59378 [FIN, ACK] Seq=126 Ack=1695 Win=66560 Len=0 TSval=854717 TSecr=354374976"
"262","5.178611","192.168.1.181","192.168.1.108","TCP","66","59377 > 2869 [FIN, ACK] Seq=1696 Ack=127 Win=14600 Len=0 TSval=354374978 TSecr=854713"
"263","5.178654","192.168.1.108","192.168.1.181","TCP","66","2869 > 59377 [ACK] Seq=127 Ack=1697 Win=66560 Len=0 TSval=854719 TSecr=354374978"
"264","5.190573","192.168.1.181","192.168.1.108","TCP","66","59378 > 2869 [FIN, ACK] Seq=1695 Ack=127 Win=14600 Len=0 TSval=354374979 TSecr=854717"
"265","5.190637","192.168.1.108","192.168.1.181","TCP","66","2869 > 59378 [ACK] Seq=127 Ack=1696 Win=66560 Len=0 TSval=854720 TSecr=354374979"
"266","5.205477","192.168.1.181","192.168.1.108","TCP","74","59379 > 2869 [SYN] Seq=0 Win=14600 Len=0 MSS=1460 SACK_PERM=1 TSval=354374980 TSecr=0 WS=2"
"267","5.205698","192.168.1.108","192.168.1.181","TCP","74","2869 > 59379 [SYN, ACK] Seq=0 Ack=1 Win=8192 Len=0 MSS=1460 WS=256 SACK_PERM=1 TSval=854721 TSecr=354374980"
"268","5.207620","192.168.1.181","192.168.1.108","TCP","66","59379 > 2869 [ACK] Seq=1 Ack=1 Win=14600 Len=0 TSval=354374981 TSecr=854721"
"269","5.211866","192.168.1.181","192.168.1.108","TCP","74","59380 > 2869 [SYN] Seq=0 Win=14600 Len=0 MSS=1460 SACK_PERM=1 TSval=354374981 TSecr=0 WS=2"
"270","5.211927","192.168.1.108","192.168.1.181","TCP","74","2869 > 59380 [SYN, ACK] Seq=0 Ack=1 Win=8192 Len=0 MSS=1460 WS=256 SACK_PERM=1 TSval=854722 TSecr=354374981"
"271","5.213681","192.168.1.181","192.168.1.108","TCP","66","59380 > 2869 [ACK] Seq=1 Ack=1 Win=14600 Len=0 TSval=354374981 TSecr=854722"
"272","5.227962","192.168.1.181","192.168.1.108","TCP","74","59381 > 2869 [SYN] Seq=0 Win=14600 Len=0 MSS=1460 SACK_PERM=1 TSval=354374983 TSecr=0 WS=2"
"273","5.228085","192.168.1.108","192.168.1.181","TCP","74","2869 > 59381 [SYN, ACK] Seq=0 Ack=1 Win=8192 Len=0 MSS=1460 WS=256 SACK_PERM=1 TSval=854724 TSecr=354374983"
"274","5.229809","192.168.1.181","192.168.1.108","TCP","66","59381 > 2869 [ACK] Seq=1 Ack=1 Win=14600 Len=0 TSval=354374983 TSecr=854724"
"275","5.233901","192.168.1.181","192.168.1.108","TCP","1514","[TCP segment of a reassembled PDU]"
"276","5.234969","192.168.1.181","192.168.1.108","HTTP/XML","311","NOTIFY /upnp/eventing/ncizuaprez HTTP/1.1 "
"277","5.235034","192.168.1.108","192.168.1.181","TCP","66","2869 > 59381 [ACK] Seq=1 Ack=1694 Win=66560 Len=0 TSval=854724 TSecr=354374983"
"278","5.235154","192.168.1.108","192.168.1.181","HTTP","191","HTTP/1.1 200 OK "
"279","5.237890","192.168.1.181","192.168.1.108","TCP","66","59381 > 2869 [ACK] Seq=1694 Ack=126 Win=14600 Len=0 TSval=354374984 TSecr=854724"
"280","5.237933","192.168.1.108","192.168.1.181","TCP","66","2869 > 59381 [FIN, ACK] Seq=126 Ack=1694 Win=66560 Len=0 TSval=854725 TSecr=354374984"
"281","5.250694","192.168.1.181","192.168.1.108","TCP","1514","[TCP segment of a reassembled PDU]"
"282","5.251732","192.168.1.181","192.168.1.108","HTTP/XML","313","NOTIFY /upnp/eventing/ipooptopyk HTTP/1.1 "
"283","5.251787","192.168.1.108","192.168.1.181","TCP","66","2869 > 59379 [ACK] Seq=1 Ack=1696 Win=66560 Len=0 TSval=854726 TSecr=354374985"
"284","5.251885","192.168.1.108","192.168.1.181","HTTP","191","HTTP/1.1 200 OK "
"285","5.254193","192.168.1.181","192.168.1.108","TCP","66","59379 > 2869 [ACK] Seq=1696 Ack=126 Win=14600 Len=0 TSval=354374985 TSecr=854726"
"286","5.254218","192.168.1.108","192.168.1.181","TCP","66","2869 > 59379 [FIN, ACK] Seq=126 Ack=1696 Win=66560 Len=0 TSval=854726 TSecr=354374985"
"287","5.258508","192.168.1.181","192.168.1.108","TCP","1514","[TCP segment of a reassembled PDU]"
"288","5.259569","192.168.1.181","192.168.1.108","HTTP/XML","313","NOTIFY /upnp/eventing/ljafbkswid HTTP/1.1 "
"289","5.259631","192.168.1.108","192.168.1.181","TCP","66","2869 > 59380 [ACK] Seq=1 Ack=1696 Win=66560 Len=0 TSval=854727 TSecr=354374986"
"290","5.259734","192.168.1.108","192.168.1.181","HTTP","191","HTTP/1.1 200 OK "
"291","5.262069","192.168.1.181","192.168.1.108","TCP","66","59380 > 2869 [ACK] Seq=1696 Ack=126 Win=14600 Len=0 TSval=354374986 TSecr=854727"
"292","5.262096","192.168.1.108","192.168.1.181","TCP","66","2869 > 59380 [FIN, ACK] Seq=126 Ack=1696 Win=66560 Len=0 TSval=854727 TSecr=354374986"
"293","5.268393","fe80::423:3956:e3c5:5411","ff02::c","SSDP","208","M-SEARCH * HTTP/1.1 "
"294","5.276155","192.168.1.181","192.168.1.108","TCP","66","59381 > 2869 [ACK] Seq=1694 Ack=127 Win=14600 Len=0 TSval=354374988 TSecr=854725"
"295","5.290972","192.168.1.181","192.168.1.108","TCP","66","59381 > 2869 [FIN, ACK] Seq=1694 Ack=127 Win=14600 Len=0 TSval=354374989 TSecr=854725"
"296","5.291019","192.168.1.108","192.168.1.181","TCP","66","2869 > 59381 [ACK] Seq=127 Ack=1695 Win=66560 Len=0 TSval=854730 TSecr=354374989"
"297","5.296045","192.168.1.181","192.168.1.108","TCP","66","59379 > 2869 [ACK] Seq=1696 Ack=127 Win=14600 Len=0 TSval=354374990 TSecr=854726"
"298","5.296384","192.168.1.181","192.168.1.108","TCP","66","59380 > 2869 [ACK] Seq=1696 Ack=127 Win=14600 Len=0 TSval=354374990 TSecr=854727"
"299","5.297839","192.168.1.181","192.168.1.108","TCP","66","59380 > 2869 [FIN, ACK] Seq=1696 Ack=127 Win=14600 Len=0 TSval=354374990 TSecr=854727"
"300","5.297865","192.168.1.108","192.168.1.181","TCP","66","2869 > 59380 [ACK] Seq=127 Ack=1697 Win=66560 Len=0 TSval=854731 TSecr=354374990"
"301","5.306278","192.168.1.181","192.168.1.108","TCP","74","59382 > 2869 [SYN] Seq=0 Win=14600 Len=0 MSS=1460 SACK_PERM=1 TSval=354374991 TSecr=0 WS=2"
"302","5.306527","192.168.1.108","192.168.1.181","TCP","74","2869 > 59382 [SYN, ACK] Seq=0 Ack=1 Win=8192 Len=0 MSS=1460 WS=256 SACK_PERM=1 TSval=854731 TSecr=354374991"
"303","5.308273","192.168.1.181","192.168.1.108","TCP","66","59382 > 2869 [ACK] Seq=1 Ack=1 Win=14600 Len=0 TSval=354374991 TSecr=854731"
"304","5.311836","192.168.1.181","192.168.1.108","TCP","74","59383 > 2869 [SYN] Seq=0 Win=14600 Len=0 MSS=1460 SACK_PERM=1 TSval=354374991 TSecr=0 WS=2"
"305","5.311951","192.168.1.108","192.168.1.181","TCP","74","2869 > 59383 [SYN, ACK] Seq=0 Ack=1 Win=8192 Len=0 MSS=1460 WS=256 SACK_PERM=1 TSval=854732 TSecr=354374991"
"306","5.313693","192.168.1.181","192.168.1.108","TCP","66","59383 > 2869 [ACK] Seq=1 Ack=1 Win=14600 Len=0 TSval=354374991 TSecr=854732"
"307","5.329726","192.168.1.181","192.168.1.108","TCP","1514","[TCP segment of a reassembled PDU]"
"308","5.330789","192.168.1.181","192.168.1.108","HTTP/XML","313","NOTIFY /upnp/eventing/flviknqdow HTTP/1.1 "
"309","5.330846","192.168.1.108","192.168.1.181","TCP","66","2869 > 59382 [ACK] Seq=1 Ack=1696 Win=66560 Len=0 TSval=854734 TSecr=354374993"
"310","5.330980","192.168.1.108","192.168.1.181","HTTP","191","HTTP/1.1 200 OK "
"311","5.333421","192.168.1.181","192.168.1.108","TCP","66","59382 > 2869 [ACK] Seq=1696 Ack=126 Win=14600 Len=0 TSval=354374993 TSecr=854734"
