"No.","Time","Source","Destination","Protocol","Length","Info"
"1","0.000000","108.160.173.162","192.168.10.26","SSL","1514","Continuation Data"
"2","0.000092","192.168.10.26","108.160.173.162","TCP","74","51071 > 443 [ACK] Seq=1 Ack=4294964377 Win=16560 Len=0 SLE=1 SRE=1461 SLE=4381 SRE=8761"
"3","0.000287","108.160.173.162","192.168.10.26","SSL","1514","Continuation Data"
"4","0.000363","192.168.10.26","108.160.173.162","TCP","66","51072 > 443 [ACK] Seq=1 Ack=1461 Win=16560 Len=0 SLE=10221 SRE=14601"
"5","0.000498","108.160.173.162","192.168.10.26","SSL","1514","Continuation Data"
"6","0.000534","192.168.10.26","108.160.173.162","TCP","66","51072 > 443 [ACK] Seq=1 Ack=2921 Win=16560 Len=0 SLE=10221 SRE=14601"
"7","0.000656","108.160.173.162","192.168.10.26","SSL","1514","Continuation Data"
"8","0.000736","192.168.10.26","108.160.173.162","TCP","66","51072 > 443 [ACK] Seq=1 Ack=4381 Win=16560 Len=0 SLE=10221 SRE=14601"
"9","0.000862","108.160.173.162","192.168.10.26","SSL","1514","Continuation Data"
"10","0.000899","192.168.10.26","108.160.173.162","TCP","66","51073 > 443 [ACK] Seq=1 Ack=4294955617 Win=65520 Len=0 SLE=1 SRE=1461"
"11","0.001018","108.160.173.162","192.168.10.26","SSL","1514","Continuation Data"
"12","0.001048","192.168.10.26","108.160.173.162","TCP","66","[TCP Dup ACK 10#1] 51073 > 443 [ACK] Seq=1 Ack=4294955617 Win=65520 Len=0 SLE=1 SRE=2921"
"13","0.001165","108.160.173.162","192.168.10.26","SSL","1514","[TCP Out-Of-Order] Continuation Data"
"14","0.001210","192.168.10.26","108.160.173.162","TCP","66","51073 > 443 [ACK] Seq=1 Ack=4294957077 Win=65520 Len=0 SLE=1 SRE=2921"
"15","0.001333","108.160.173.162","192.168.10.26","SSL","1514","[TCP Out-Of-Order] Continuation Data"
"16","0.001363","192.168.10.26","108.160.173.162","TCP","66","51073 > 443 [ACK] Seq=1 Ack=4294958537 Win=65520 Len=0 SLE=1 SRE=2921"
"17","0.001483","108.160.173.162","192.168.10.26","SSL","1514","[TCP Out-Of-Order] Continuation Data"
"18","0.001541","192.168.10.26","108.160.173.162","TCP","66","51073 > 443 [ACK] Seq=1 Ack=4294959997 Win=65520 Len=0 SLE=1 SRE=2921"
"19","0.001667","74.125.227.175","192.168.10.26","TCP","66","80 > 51138 [ACK] Seq=1 Ack=1 Win=344 Len=0 SLE=0 SRE=1"
"20","0.001759","Fortinet_b3:c6:01","IntelCor_c7:bb:3c","ARP","56","Who has 192.168.10.26?  Tell 192.168.10.1"
"21","0.001782","IntelCor_c7:bb:3c","Fortinet_b3:c6:01","ARP","42","192.168.10.26 is at a0:88:b4:c7:bb:3c"
"22","0.001898","216.58.218.170","192.168.10.26","TCP","66","443 > 51143 [ACK] Seq=1 Ack=1 Win=352 Len=0 SLE=0 SRE=1"
"23","0.001945","216.58.218.174","192.168.10.26","TCP","66","443 > 51146 [ACK] Seq=1 Ack=1 Win=355 Len=0 SLE=0 SRE=1"
"24","0.002009","Fortinet_b3:c6:01","IntelCor_c7:bb:3c","ARP","56","Who has 192.168.10.26?  Tell 192.168.10.1"
"25","0.002025","IntelCor_c7:bb:3c","Fortinet_b3:c6:01","ARP","42","192.168.10.26 is at a0:88:b4:c7:bb:3c"
"26","0.002139","108.160.173.162","192.168.10.26","SSL","1514","[TCP Out-Of-Order] Continuation Data"
"27","0.002194","192.168.10.26","108.160.173.162","TCP","74","51071 > 443 [ACK] Seq=1 Ack=4294965837 Win=16560 Len=0 SLE=1 SRE=1461 SLE=4381 SRE=8761"
"28","0.002330","Fortinet_b3:c6:01","IntelCor_c7:bb:3c","ARP","56","Who has 192.168.10.26?  Tell 192.168.10.1"
"29","0.002348","IntelCor_c7:bb:3c","Fortinet_b3:c6:01","ARP","42","192.168.10.26 is at a0:88:b4:c7:bb:3c"
"30","0.002459","108.160.173.162","192.168.10.26","SSL","1514","Continuation Data"
"31","0.002510","192.168.10.26","108.160.173.162","TCP","66","51074 > 443 [ACK] Seq=1 Ack=1461 Win=16560 Len=0 SLE=8761 SRE=11681"
"32","0.002634","108.160.173.162","192.168.10.26","SSL","1514","[TCP Out-Of-Order] Continuation Data"
"33","0.002661","192.168.10.26","108.160.173.162","TCP","74","[TCP Dup ACK 8#1] 51072 > 443 [ACK] Seq=1 Ack=4381 Win=16560 Len=0 SLE=1 SRE=1461 SLE=10221 SRE=14601"
"34","0.002782","54.230.6.15","192.168.10.26","TCP","1514","[TCP segment of a reassembled PDU]"
"35","0.002834","192.168.10.26","54.230.6.15","TCP","66","51063 > 443 [ACK] Seq=1 Ack=1461 Win=48545 Len=0 SLE=16061 SRE=20441"
"36","0.002961","54.230.6.15","192.168.10.26","TCP","1514","[TCP Previous segment not captured] [TCP segment of a reassembled PDU]"
"37","0.002991","192.168.10.26","54.230.6.15","TCP","66","[TCP Dup ACK 35#1] 51063 > 443 [ACK] Seq=1 Ack=1461 Win=48545 Len=0 SLE=16061 SRE=21901"
"38","0.003112","54.230.6.15","192.168.10.26","TCP","1514","[TCP segment of a reassembled PDU]"
"39","0.003142","192.168.10.26","54.230.6.15","TCP","66","[TCP Dup ACK 35#2] 51063 > 443 [ACK] Seq=1 Ack=1461 Win=48545 Len=0 SLE=16061 SRE=23361"
"40","0.003265","54.230.6.15","192.168.10.26","TCP","1514","[TCP Out-Of-Order] [TCP segment of a reassembled PDU]"
"41","0.003291","192.168.10.26","54.230.6.15","TCP","74","[TCP Dup ACK 35#3] 51063 > 443 [ACK] Seq=1 Ack=1461 Win=48545 Len=0 SLE=1 SRE=1461 SLE=16061 SRE=23361"
"42","0.003411","54.230.6.15","192.168.10.26","TCP","1514","[TCP Fast Retransmission] [TCP segment of a reassembled PDU]"
"43","0.003441","192.168.10.26","54.230.6.15","TCP","66","51063 > 443 [ACK] Seq=1 Ack=2921 Win=48545 Len=0 SLE=16061 SRE=23361"
"44","0.003562","54.230.6.15","192.168.10.26","TCP","1514","[TCP Out-Of-Order] [TCP segment of a reassembled PDU]"
"45","0.003648","192.168.10.26","54.230.6.15","TCP","66","51063 > 443 [ACK] Seq=1 Ack=4381 Win=48545 Len=0 SLE=16061 SRE=23361"
"46","0.003777","108.160.173.162","192.168.10.26","SSL","1514","[TCP Previous segment not captured] Continuation Data"
"47","0.003808","192.168.10.26","108.160.173.162","TCP","66","[TCP Dup ACK 31#1] 51074 > 443 [ACK] Seq=1 Ack=1461 Win=16560 Len=0 SLE=8761 SRE=13141"
"48","0.003931","108.160.173.162","192.168.10.26","SSL","1514","Continuation Data"
"49","0.003961","192.168.10.26","108.160.173.162","TCP","66","[TCP Dup ACK 31#2] 51074 > 443 [ACK] Seq=1 Ack=1461 Win=16560 Len=0 SLE=8761 SRE=14601"
"50","0.004084","108.160.173.162","192.168.10.26","SSL","1514","Continuation Data"
"51","0.004114","192.168.10.26","108.160.173.162","TCP","66","[TCP Dup ACK 31#3] 51074 > 443 [ACK] Seq=1 Ack=1461 Win=16560 Len=0 SLE=8761 SRE=16061"
"52","0.004236","108.160.173.162","192.168.10.26","SSL","1514","[TCP Previous segment not captured] Continuation Data"
"53","0.004266","192.168.10.26","108.160.173.162","TCP","74","[TCP Dup ACK 27#1] 51071 > 443 [ACK] Seq=1 Ack=4294965837 Win=16560 Len=0 SLE=4381 SRE=10221 SLE=1 SRE=1461"
"54","0.004389","108.160.173.162","192.168.10.26","SSL","1514","Continuation Data"
"55","0.004419","192.168.10.26","108.160.173.162","TCP","74","[TCP Dup ACK 27#2] 51071 > 443 [ACK] Seq=1 Ack=4294965837 Win=16560 Len=0 SLE=4381 SRE=11681 SLE=1 SRE=1461"
"56","0.004542","108.160.173.162","192.168.10.26","SSL","1514","[TCP Previous segment not captured] Continuation Data"
"57","0.004572","192.168.10.26","108.160.173.162","TCP","66","[TCP Dup ACK 8#2] 51072 > 443 [ACK] Seq=1 Ack=4381 Win=16560 Len=0 SLE=10221 SRE=16061"
"58","0.004695","108.160.173.162","192.168.10.26","SSL","1514","Continuation Data"
"59","0.004725","192.168.10.26","108.160.173.162","TCP","66","[TCP Dup ACK 8#3] 51072 > 443 [ACK] Seq=1 Ack=4381 Win=16560 Len=0 SLE=10221 SRE=17521"
"60","0.004846","108.160.173.162","192.168.10.26","SSL","1514","[TCP Out-Of-Order] Continuation Data"
"61","0.004872","192.168.10.26","108.160.173.162","TCP","82","[TCP Dup ACK 27#3] 51071 > 443 [ACK] Seq=1 Ack=4294965837 Win=16560 Len=0 SLE=4294964377 SRE=4294965837 SLE=4381 SRE=11681 SLE=1 SRE=1461"
"62","0.004994","108.160.173.162","192.168.10.26","SSL","1514","[TCP Fast Retransmission] Continuation Data"
"63","0.005064","192.168.10.26","108.160.173.162","TCP","66","51071 > 443 [ACK] Seq=1 Ack=1461 Win=16560 Len=0 SLE=4381 SRE=11681"
"64","0.005427","108.160.173.162","192.168.10.26","SSL","1514","[TCP Spurious Retransmission] Continuation Data"
"65","0.005457","192.168.10.26","108.160.173.162","TCP","74","[TCP Dup ACK 18#1] 51073 > 443 [ACK] Seq=1 Ack=4294959997 Win=65520 Len=0 SLE=4294955617 SRE=4294957077 SLE=1 SRE=2921"
"66","0.043933","54.230.6.15","192.168.10.26","TCP","1514","[TCP segment of a reassembled PDU]"
"67","0.044026","192.168.10.26","54.230.6.15","TCP","66","[TCP Dup ACK 45#1] 51063 > 443 [ACK] Seq=1 Ack=4381 Win=48545 Len=0 SLE=16061 SRE=24821"
"68","0.046834","54.230.6.15","192.168.10.26","TCP","1514","[TCP segment of a reassembled PDU]"
"69","0.046930","192.168.10.26","54.230.6.15","TCP","66","[TCP Dup ACK 45#2] 51063 > 443 [ACK] Seq=1 Ack=4381 Win=48545 Len=0 SLE=16061 SRE=26281"
"70","0.048301","54.230.6.15","192.168.10.26","TCP","1514","[TCP Fast Retransmission] [TCP segment of a reassembled PDU]"
"71","0.048400","192.168.10.26","54.230.6.15","TCP","66","51063 > 443 [ACK] Seq=1 Ack=5841 Win=48180 Len=0 SLE=16061 SRE=26281"
"72","0.051861","54.230.6.15","192.168.10.26","SSLv2","1514","[TCP Retransmission] Encrypted Data"
"73","0.052046","192.168.10.26","54.230.6.15","TCP","66","51063 > 443 [ACK] Seq=1 Ack=7301 Win=47815 Len=0 SLE=16061 SRE=26281"
"74","0.054119","54.230.6.15","192.168.10.26","TCP","1514","[TCP Retransmission] [TCP segment of a reassembled PDU]"
"75","0.054213","192.168.10.26","54.230.6.15","TCP","66","51063 > 443 [ACK] Seq=1 Ack=8761 Win=47450 Len=0 SLE=16061 SRE=26281"
"76","0.054462","54.230.6.15","192.168.10.26","TCP","1514","[TCP Retransmission] [TCP segment of a reassembled PDU]"
"77","0.054504","192.168.10.26","54.230.6.15","TCP","66","51063 > 443 [ACK] Seq=1 Ack=10221 Win=47085 Len=0 SLE=16061 SRE=26281"
"78","0.057827","54.230.6.15","192.168.10.26","TCP","1514","[TCP Retransmission] [TCP segment of a reassembled PDU]"
"79","0.058009","192.168.10.26","54.230.6.15","TCP","66","51063 > 443 [ACK] Seq=1 Ack=11681 Win=46720 Len=0 SLE=16061 SRE=26281"
"80","0.060681","54.230.6.15","192.168.10.26","TCP","1514","[TCP Retransmission] [TCP segment of a reassembled PDU]"
"81","0.060753","192.168.10.26","54.230.6.15","TCP","66","51063 > 443 [ACK] Seq=1 Ack=13141 Win=46355 Len=0 SLE=16061 SRE=26281"
"82","0.061948","54.230.6.15","192.168.10.26","TCP","1514","[TCP Retransmission] [TCP segment of a reassembled PDU]"
"83","0.062072","192.168.10.26","54.230.6.15","TCP","66","51063 > 443 [ACK] Seq=1 Ack=14601 Win=45990 Len=0 SLE=16061 SRE=26281"
"84","0.064666","54.230.6.15","192.168.10.26","TCP","1514","[TCP Retransmission] [TCP segment of a reassembled PDU]"
"85","0.064832","192.168.10.26","54.230.6.15","TCP","54","51063 > 443 [ACK] Seq=1 Ack=26281 Win=44895 Len=0"
"86","0.067636","54.230.6.15","192.168.10.26","TCP","1514","[TCP segment of a reassembled PDU]"
"87","0.069220","108.160.173.162","192.168.10.26","SSL","1514","Continuation Data"
"88","0.069277","192.168.10.26","108.160.173.162","TCP","66","[TCP Dup ACK 8#4] 51072 > 443 [ACK] Seq=1 Ack=4381 Win=16560 Len=0 SLE=10221 SRE=18981"
"89","0.072198","108.160.173.162","192.168.10.26","SSL","1514","Continuation Data"
"90","0.072264","192.168.10.26","108.160.173.162","TCP","66","[TCP Dup ACK 8#5] 51072 > 443 [ACK] Seq=1 Ack=4381 Win=16560 Len=0 SLE=10221 SRE=20441"
"91","0.075173","108.160.173.162","192.168.10.26","SSL","1514","[TCP Fast Retransmission] Continuation Data"
"92","0.075257","192.168.10.26","108.160.173.162","TCP","66","51072 > 443 [ACK] Seq=1 Ack=5841 Win=16560 Len=0 SLE=10221 SRE=20441"
"93","0.076620","108.160.173.162","192.168.10.26","SSL","1514","Continuation Data"
"94","0.076689","192.168.10.26","108.160.173.162","TCP","66","[TCP Dup ACK 18#2] 51073 > 443 [ACK] Seq=1 Ack=4294959997 Win=65520 Len=0 SLE=1 SRE=4381"
"95","0.081214","108.160.173.162","192.168.10.26","SSL","1514","Continuation Data"
"96","0.081312","192.168.10.26","108.160.173.162","TCP","66","[TCP Dup ACK 18#3] 51073 > 443 [ACK] Seq=1 Ack=4294959997 Win=65520 Len=0 SLE=1 SRE=5841"
"97","0.081620","108.160.173.162","192.168.10.26","SSL","1514","[TCP Fast Retransmission] Continuation Data"
"98","0.081679","192.168.10.26","108.160.173.162","TCP","66","51073 > 443 [ACK] Seq=1 Ack=4294961457 Win=65520 Len=0 SLE=1 SRE=5841"
"99","0.083575","108.160.173.162","192.168.10.26","SSL","1514","Continuation Data"
"100","0.083667","192.168.10.26","108.160.173.162","TCP","66","[TCP Dup ACK 63#1] 51071 > 443 [ACK] Seq=1 Ack=1461 Win=16560 Len=0 SLE=4381 SRE=13141"
"101","0.085073","108.160.173.162","192.168.10.26","SSL","1514","Continuation Data"
"102","0.085153","192.168.10.26","108.160.173.162","TCP","66","[TCP Dup ACK 63#2] 51071 > 443 [ACK] Seq=1 Ack=1461 Win=16560 Len=0 SLE=4381 SRE=14601"
"103","0.089137","108.160.173.162","192.168.10.26","SSL","1514","Continuation Data"
"104","0.089233","192.168.10.26","108.160.173.162","TCP","66","[TCP Dup ACK 31#4] 51074 > 443 [ACK] Seq=1 Ack=1461 Win=16560 Len=0 SLE=8761 SRE=17521"
"105","0.089536","108.160.173.162","192.168.10.26","SSL","1514","Continuation Data"
"106","0.089585","192.168.10.26","108.160.173.162","TCP","66","[TCP Dup ACK 31#5] 51074 > 443 [ACK] Seq=1 Ack=1461 Win=16560 Len=0 SLE=8761 SRE=18981"
"107","0.093148","54.230.6.15","192.168.10.26","TCP","1514","[TCP segment of a reassembled PDU]"
"108","0.093224","192.168.10.26","54.230.6.15","TCP","54","51063 > 443 [ACK] Seq=1 Ack=29201 Win=44530 Len=0"
"109","0.095633","54.230.6.15","192.168.10.26","TCP","1514","[TCP segment of a reassembled PDU]"
"110","0.097545","54.230.6.15","192.168.10.26","TCP","1514","[TCP segment of a reassembled PDU]"
"111","0.097615","192.168.10.26","54.230.6.15","TCP","54","51063 > 443 [ACK] Seq=1 Ack=32121 Win=43800 Len=0"
"112","0.099658","54.230.6.15","192.168.10.26","TCP","1514","[TCP segment of a reassembled PDU]"
"113","0.102563","54.230.6.15","192.168.10.26","TCP","1514","[TCP segment of a reassembled PDU]"
"114","0.102630","192.168.10.26","54.230.6.15","TCP","54","51063 > 443 [ACK] Seq=1 Ack=35041 Win=43070 Len=0"
"115","0.104027","54.230.6.15","192.168.10.26","TCP","1514","[TCP segment of a reassembled PDU]"
"116","0.106532","108.160.173.162","192.168.10.26","SSL","1514","[TCP Fast Retransmission] Continuation Data"
"117","0.106593","192.168.10.26","108.160.173.162","TCP","66","51074 > 443 [ACK] Seq=1 Ack=2921 Win=16560 Len=0 SLE=8761 SRE=18981"
"118","0.108710","108.160.173.162","192.168.10.26","SSL","1514","[TCP Retransmission] Continuation Data"
"119","0.108818","192.168.10.26","108.160.173.162","TCP","66","51074 > 443 [ACK] Seq=1 Ack=4381 Win=16560 Len=0 SLE=8761 SRE=18981"
"120","0.110745","108.160.173.162","192.168.10.26","SSL","1514","[TCP Retransmission] Continuation Data"
"121","0.110813","192.168.10.26","108.160.173.162","TCP","66","51074 > 443 [ACK] Seq=1 Ack=5841 Win=16560 Len=0 SLE=8761 SRE=18981"
"122","0.113825","108.160.173.162","192.168.10.26","SSL","1514","[TCP Retransmission] Continuation Data"
"123","0.113970","192.168.10.26","108.160.173.162","TCP","66","51074 > 443 [ACK] Seq=1 Ack=7301 Win=16560 Len=0 SLE=8761 SRE=18981"
"124","0.115355","54.230.6.15","192.168.10.26","TCP","1514","[TCP segment of a reassembled PDU]"
"125","0.115479","192.168.10.26","54.230.6.15","TCP","54","51063 > 443 [ACK] Seq=1 Ack=37961 Win=42705 Len=0"
"126","0.118179","54.230.6.15","192.168.10.26","TCP","1514","[TCP segment of a reassembled PDU]"
"127","0.120671","108.160.173.162","192.168.10.26","SSL","1514","[TCP Retransmission] Continuation Data"
"128","0.120761","192.168.10.26","108.160.173.162","TCP","66","51071 > 443 [ACK] Seq=1 Ack=2921 Win=16560 Len=0 SLE=4381 SRE=14601"
"129","0.122852","108.160.173.162","192.168.10.26","SSL","1514","[TCP Retransmission] Continuation Data"
"130","0.123027","192.168.10.26","108.160.173.162","TCP","54","51071 > 443 [ACK] Seq=1 Ack=14601 Win=16560 Len=0"
"131","0.124745","108.160.173.162","192.168.10.26","SSL","1514","[TCP Retransmission] Continuation Data"
"132","0.124847","192.168.10.26","108.160.173.162","TCP","66","51072 > 443 [ACK] Seq=1 Ack=7301 Win=16560 Len=0 SLE=10221 SRE=20441"
"133","0.131978","54.230.6.15","192.168.10.26","TCP","1514","[TCP segment of a reassembled PDU]"
"134","0.132158","192.168.10.26","54.230.6.15","TCP","54","51063 > 443 [ACK] Seq=1 Ack=40881 Win=41975 Len=0"
"135","0.133148","54.230.6.15","192.168.10.26","TCP","1514","[TCP segment of a reassembled PDU]"
"136","0.133233","54.230.6.15","192.168.10.26","TCP","1514","[TCP segment of a reassembled PDU]"
"137","0.133322","192.168.10.26","54.230.6.15","TCP","54","51063 > 443 [ACK] Seq=1 Ack=43801 Win=41975 Len=0"
"138","0.133533","54.230.6.15","192.168.10.26","TCP","1514","[TCP segment of a reassembled PDU]"
"139","0.136348","54.230.6.15","192.168.10.26","TCP","1514","[TCP segment of a reassembled PDU]"
"140","0.136442","192.168.10.26","54.230.6.15","TCP","54","51063 > 443 [ACK] Seq=1 Ack=46721 Win=45260 Len=0"
"141","0.139661","54.230.6.15","192.168.10.26","TCP","1514","[TCP segment of a reassembled PDU]"
"142","0.140565","54.230.6.15","192.168.10.26","TCP","1514","[TCP segment of a reassembled PDU]"
"143","0.140640","192.168.10.26","54.230.6.15","TCP","54","51063 > 443 [ACK] Seq=1 Ack=49641 Win=44530 Len=0"
"144","0.144048","54.230.6.15","192.168.10.26","TCP","1514","[TCP segment of a reassembled PDU]"
"145","0.144370","54.230.6.15","192.168.10.26","TCP","1514","[TCP segment of a reassembled PDU]"
"146","0.144422","192.168.10.26","54.230.6.15","TCP","54","51063 > 443 [ACK] Seq=1 Ack=52561 Win=44165 Len=0"
"147","0.147944","54.230.6.15","192.168.10.26","TCP","1514","[TCP segment of a reassembled PDU]"
"148","0.149629","54.230.6.15","192.168.10.26","SSLv2","1514","Encrypted Data"
"149","0.149800","192.168.10.26","54.230.6.15","TCP","54","51063 > 443 [ACK] Seq=1 Ack=55481 Win=46720 Len=0"
"150","0.152213","54.230.6.15","192.168.10.26","TCP","1514","[TCP segment of a reassembled PDU]"
"151","0.154004","54.230.6.15","192.168.10.26","TCP","1514","[TCP segment of a reassembled PDU]"
"152","0.154199","192.168.10.26","54.230.6.15","TCP","54","51063 > 443 [ACK] Seq=1 Ack=58401 Win=45990 Len=0"
"153","0.157622","54.230.6.15","192.168.10.26","TCP","1514","[TCP segment of a reassembled PDU]"
"154","0.159741","54.230.6.15","192.168.10.26","TCP","1514","[TCP segment of a reassembled PDU]"
"155","0.159974","192.168.10.26","54.230.6.15","TCP","54","51063 > 443 [ACK] Seq=1 Ack=61321 Win=45260 Len=0"
"156","0.162485","54.230.6.15","192.168.10.26","TCP","1514","[TCP segment of a reassembled PDU]"
"157","0.162874","54.230.6.15","192.168.10.26","TCP","1514","[TCP segment of a reassembled PDU]"
"158","0.162923","192.168.10.26","54.230.6.15","TCP","54","51063 > 443 [ACK] Seq=1 Ack=64241 Win=44895 Len=0"
"159","0.166595","54.230.6.15","192.168.10.26","TCP","1514","[TCP segment of a reassembled PDU]"
"160","0.169716","54.230.6.15","192.168.10.26","TCP","1514","[TCP segment of a reassembled PDU]"
"161","0.169822","192.168.10.26","54.230.6.15","TCP","54","51063 > 443 [ACK] Seq=1 Ack=67161 Win=47450 Len=0"
"162","0.171530","108.160.173.162","192.168.10.26","SSL","1514","[TCP Retransmission] Continuation Data"
"163","0.171616","192.168.10.26","108.160.173.162","TCP","66","51072 > 443 [ACK] Seq=1 Ack=8761 Win=16560 Len=0 SLE=10221 SRE=20441"
"164","0.173840","54.230.6.15","192.168.10.26","TCP","1514","[TCP segment of a reassembled PDU]"
"165","0.174897","54.230.6.15","192.168.10.26","TCP","1514","[TCP segment of a reassembled PDU]"
"166","0.174989","192.168.10.26","54.230.6.15","TCP","54","51063 > 443 [ACK] Seq=1 Ack=70081 Win=46720 Len=0"
"167","0.178514","54.230.6.15","192.168.10.26","TCP","1514","[TCP segment of a reassembled PDU]"
"168","0.180591","108.160.173.162","192.168.10.26","SSL","1514","[TCP Retransmission] Continuation Data"
"169","0.180763","192.168.10.26","108.160.173.162","TCP","66","51073 > 443 [ACK] Seq=1 Ack=4294962917 Win=65520 Len=0 SLE=1 SRE=5841"
"170","0.181999","108.160.173.162","192.168.10.26","SSL","1514","[TCP Retransmission] Continuation Data"
"171","0.182064","192.168.10.26","108.160.173.162","TCP","66","51073 > 443 [ACK] Seq=1 Ack=4294964377 Win=65520 Len=0 SLE=1 SRE=5841"
"172","0.184672","54.230.6.15","192.168.10.26","TCP","1514","[TCP segment of a reassembled PDU]"
"173","0.184770","192.168.10.26","54.230.6.15","TCP","54","51063 > 443 [ACK] Seq=1 Ack=73001 Win=45990 Len=0"
"174","0.187947","54.230.6.15","192.168.10.26","TCP","1514","[TCP segment of a reassembled PDU]"
"175","0.189505","54.230.6.15","192.168.10.26","TCP","1514","[TCP segment of a reassembled PDU]"
"176","0.189702","192.168.10.26","54.230.6.15","TCP","54","51063 > 443 [ACK] Seq=1 Ack=75921 Win=45260 Len=0"
"177","0.191752","108.160.173.162","192.168.10.26","SSL","1514","Continuation Data"
"178","0.194630","108.160.173.162","192.168.10.26","SSL","1514","Continuation Data"
"179","0.194727","192.168.10.26","108.160.173.162","TCP","54","51071 > 443 [ACK] Seq=1 Ack=17521 Win=16560 Len=0"
"180","0.196835","108.160.173.162","192.168.10.26","SSL","1514","[TCP Retransmission] Continuation Data"
"181","0.197022","192.168.10.26","108.160.173.162","TCP","54","51074 > 443 [ACK] Seq=1 Ack=18981 Win=16560 Len=0"
"182","0.199185","108.160.173.162","192.168.10.26","SSL","1514","Continuation Data"
"183","0.201674","54.230.6.15","192.168.10.26","TCP","1514","[TCP segment of a reassembled PDU]"
"184","0.203753","54.230.6.15","192.168.10.26","TCP","1514","[TCP segment of a reassembled PDU]"
"185","0.203949","192.168.10.26","54.230.6.15","TCP","54","51063 > 443 [ACK] Seq=1 Ack=78841 Win=44530 Len=0"
"186","0.205726","54.230.6.15","192.168.10.26","TCP","1514","[TCP segment of a reassembled PDU]"
"187","0.207922","54.230.6.15","192.168.10.26","TCP","1514","[TCP segment of a reassembled PDU]"
"188","0.208013","192.168.10.26","54.230.6.15","TCP","54","51063 > 443 [ACK] Seq=1 Ack=81761 Win=43800 Len=0"
"189","0.210817","54.230.6.15","192.168.10.26","TCP","1514","[TCP segment of a reassembled PDU]"
"190","0.211885","54.230.6.15","192.168.10.26","TCP","1514","[TCP segment of a reassembled PDU]"
"191","0.211955","192.168.10.26","54.230.6.15","TCP","54","51063 > 443 [ACK] Seq=1 Ack=84681 Win=43070 Len=0"
"192","0.215695","54.230.6.15","192.168.10.26","TCP","1514","[TCP segment of a reassembled PDU]"
"193","0.216886","54.230.6.15","192.168.10.26","TCP","1514","[TCP segment of a reassembled PDU]"
"194","0.216966","192.168.10.26","54.230.6.15","TCP","54","51063 > 443 [ACK] Seq=1 Ack=87601 Win=42705 Len=0"
"195","0.219756","54.230.6.15","192.168.10.26","TCP","1514","[TCP segment of a reassembled PDU]"
"196","0.220971","108.160.173.162","192.168.10.26","SSL","1514","Continuation Data"
"197","0.221067","192.168.10.26","108.160.173.162","TCP","54","51074 > 443 [ACK] Seq=1 Ack=21901 Win=16560 Len=0"
"198","0.224566","54.230.6.15","192.168.10.26","TCP","1514","[TCP segment of a reassembled PDU]"
"199","0.224642","192.168.10.26","54.230.6.15","TCP","54","51063 > 443 [ACK] Seq=1 Ack=90521 Win=41975 Len=0"
"200","0.226497","54.230.6.15","192.168.10.26","TCP","1514","[TCP segment of a reassembled PDU]"
"201","0.234448","54.230.6.15","192.168.10.26","TCP","1514","[TCP segment of a reassembled PDU]"
"202","0.234650","192.168.10.26","54.230.6.15","TCP","54","51063 > 443 [ACK] Seq=1 Ack=93441 Win=41610 Len=0"
"203","0.235397","108.160.173.162","192.168.10.26","SSL","1514","Continuation Data"
"204","0.235548","108.160.173.162","192.168.10.26","SSL","1514","Continuation Data"
"205","0.235589","192.168.10.26","108.160.173.162","TCP","54","51074 > 443 [ACK] Seq=1 Ack=24821 Win=16560 Len=0"
"206","0.235893","54.230.6.15","192.168.10.26","TCP","1514","[TCP segment of a reassembled PDU]"
"207","0.238789","54.230.6.15","192.168.10.26","TCP","1514","[TCP segment of a reassembled PDU]"
"208","0.238968","192.168.10.26","54.230.6.15","TCP","54","51063 > 443 [ACK] Seq=1 Ack=96361 Win=41245 Len=0"
"209","0.240185","54.230.6.15","192.168.10.26","TCP","1514","[TCP segment of a reassembled PDU]"
"210","0.241980","108.160.173.162","192.168.10.26","SSL","1514","Continuation Data"
"211","0.244631","54.230.6.15","192.168.10.26","TCP","1514","[TCP segment of a reassembled PDU]"
"212","0.244827","192.168.10.26","54.230.6.15","TCP","54","51063 > 443 [ACK] Seq=1 Ack=99281 Win=40515 Len=0"
"213","0.247867","54.230.6.15","192.168.10.26","TCP","1514","[TCP segment of a reassembled PDU]"
"214","0.248930","54.230.6.15","192.168.10.26","TCP","1514","[TCP segment of a reassembled PDU]"
"215","0.249101","192.168.10.26","54.230.6.15","TCP","54","51063 > 443 [ACK] Seq=1 Ack=102201 Win=40150 Len=0"
"216","0.251878","108.160.173.162","192.168.10.26","SSL","1514","[TCP Retransmission] Continuation Data"
"217","0.252061","192.168.10.26","108.160.173.162","TCP","54","51072 > 443 [ACK] Seq=1 Ack=20441 Win=16560 Len=0"
"218","0.255281","54.230.6.15","192.168.10.26","TCP","1514","[TCP segment of a reassembled PDU]"
"219","0.256192","54.230.6.15","192.168.10.26","TCP","1514","[TCP segment of a reassembled PDU]"
"220","0.256268","192.168.10.26","54.230.6.15","TCP","54","51063 > 443 [ACK] Seq=1 Ack=105121 Win=39785 Len=0"
"221","0.258852","54.230.6.15","192.168.10.26","TCP","1514","[TCP segment of a reassembled PDU]"
"222","0.260965","54.230.6.15","192.168.10.26","TCP","1514","[TCP segment of a reassembled PDU]"
"223","0.261064","192.168.10.26","54.230.6.15","TCP","54","51063 > 443 [ACK] Seq=1 Ack=108041 Win=39420 Len=0"
"224","0.263852","54.230.6.15","192.168.10.26","TCP","1514","[TCP segment of a reassembled PDU]"
"225","0.265755","54.230.6.15","192.168.10.26","TCP","1514","[TCP segment of a reassembled PDU]"
"226","0.265855","192.168.10.26","54.230.6.15","TCP","54","51063 > 443 [ACK] Seq=1 Ack=110961 Win=39055 Len=0"
"227","0.269406","54.230.6.15","192.168.10.26","SSLv2","1514","Encrypted Data"
"228","0.269929","54.230.6.15","192.168.10.26","TCP","1514","[TCP segment of a reassembled PDU]"
"229","0.270071","192.168.10.26","54.230.6.15","TCP","54","51063 > 443 [ACK] Seq=1 Ack=113881 Win=39055 Len=0"
"230","0.272082","54.230.6.15","192.168.10.26","SSLv2","1514","Encrypted Data"
"231","0.274556","54.230.6.15","192.168.10.26","TCP","1514","[TCP segment of a reassembled PDU]"
"232","0.274694","192.168.10.26","54.230.6.15","TCP","54","51063 > 443 [ACK] Seq=1 Ack=116801 Win=42340 Len=0"
"233","0.277848","54.230.6.15","192.168.10.26","TCP","1514","[TCP segment of a reassembled PDU]"
"234","0.279566","54.230.6.15","192.168.10.26","TCP","1514","[TCP segment of a reassembled PDU]"
"235","0.279729","192.168.10.26","54.230.6.15","TCP","54","51063 > 443 [ACK] Seq=1 Ack=119721 Win=41975 Len=0"
"236","0.282275","54.230.6.15","192.168.10.26","TCP","1514","[TCP segment of a reassembled PDU]"
"237","0.285879","54.230.6.15","192.168.10.26","TCP","1514","[TCP segment of a reassembled PDU]"
"238","0.285981","192.168.10.26","54.230.6.15","TCP","54","51063 > 443 [ACK] Seq=1 Ack=122641 Win=41610 Len=0"
"239","0.286374","54.230.6.15","192.168.10.26","TCP","1514","[TCP segment of a reassembled PDU]"
"240","0.288101","54.230.6.15","192.168.10.26","TCP","1514","[TCP segment of a reassembled PDU]"
"241","0.288195","192.168.10.26","54.230.6.15","TCP","54","51063 > 443 [ACK] Seq=1 Ack=125561 Win=44895 Len=0"
"242","0.290948","54.230.6.15","192.168.10.26","TCP","1514","[TCP segment of a reassembled PDU]"
"243","0.292637","54.230.6.15","192.168.10.26","TCP","1514","[TCP segment of a reassembled PDU]"
"244","0.292737","192.168.10.26","54.230.6.15","TCP","54","51063 > 443 [ACK] Seq=1 Ack=128481 Win=44165 Len=0"
"245","0.295751","54.230.6.15","192.168.10.26","TCP","1514","[TCP segment of a reassembled PDU]"
"246","0.298646","54.230.6.15","192.168.10.26","TCP","1514","[TCP segment of a reassembled PDU]"
"247","0.298837","192.168.10.26","54.230.6.15","TCP","54","51063 > 443 [ACK] Seq=1 Ack=131401 Win=43435 Len=0"
"248","0.299323","54.230.6.15","192.168.10.26","TCP","1514","[TCP segment of a reassembled PDU]"
"249","0.302128","108.160.173.162","192.168.10.26","SSL","1514","Continuation Data"
"250","0.305679","108.160.173.162","192.168.10.26","SSL","1514","[TCP Retransmission] Continuation Data"
"251","0.305784","192.168.10.26","108.160.173.162","TCP","66","51073 > 443 [ACK] Seq=1 Ack=4294965837 Win=65520 Len=0 SLE=1 SRE=5841"
"252","0.306994","108.160.173.162","192.168.10.26","SSL","1514","[TCP Retransmission] Continuation Data"
"253","0.307151","192.168.10.26","108.160.173.162","TCP","54","51073 > 443 [ACK] Seq=1 Ack=5841 Win=65520 Len=0"
"254","0.309826","54.230.6.15","192.168.10.26","TCP","1514","[TCP segment of a reassembled PDU]"
"255","0.310012","192.168.10.26","54.230.6.15","TCP","54","51063 > 443 [ACK] Seq=1 Ack=134321 Win=46720 Len=0"
"256","0.311635","54.230.6.15","192.168.10.26","TCP","1514","[TCP segment of a reassembled PDU]"
"257","0.313919","54.230.6.15","192.168.10.26","TCP","1514","[TCP segment of a reassembled PDU]"
"258","0.314112","192.168.10.26","54.230.6.15","TCP","54","51063 > 443 [ACK] Seq=1 Ack=137241 Win=45990 Len=0"
"259","0.316681","54.230.6.15","192.168.10.26","TCP","1514","[TCP segment of a reassembled PDU]"
"260","0.317905","54.230.6.15","192.168.10.26","TCP","1514","[TCP segment of a reassembled PDU]"
"261","0.317971","192.168.10.26","54.230.6.15","TCP","54","51063 > 443 [ACK] Seq=1 Ack=140161 Win=45260 Len=0"
"262","0.320830","54.230.6.15","192.168.10.26","TCP","1514","[TCP segment of a reassembled PDU]"
"263","0.323666","54.230.6.15","192.168.10.26","TCP","1514","[TCP segment of a reassembled PDU]"
"264","0.323767","192.168.10.26","54.230.6.15","TCP","54","51063 > 443 [ACK] Seq=1 Ack=143081 Win=44530 Len=0"
"265","0.325119","54.230.6.15","192.168.10.26","TCP","1514","[TCP segment of a reassembled PDU]"
"266","0.327569","108.160.173.162","192.168.10.26","SSL","1514","Continuation Data"
"267","0.329957","108.160.173.162","192.168.10.26","SSL","1514","Continuation Data"
"268","0.330051","192.168.10.26","108.160.173.162","TCP","54","51071 > 443 [ACK] Seq=1 Ack=20441 Win=16560 Len=0"
"269","0.336737","108.160.173.162","192.168.10.26","SSL","1514","Continuation Data"
"270","0.339628","108.160.173.162","192.168.10.26","SSL","1514","Continuation Data"
"271","0.339723","192.168.10.26","108.160.173.162","TCP","54","51074 > 443 [ACK] Seq=1 Ack=27741 Win=16560 Len=0"
"272","0.340019","108.160.173.162","192.168.10.26","SSL","1514","Continuation Data"
"273","0.340237","108.160.173.162","192.168.10.26","SSL","1514","Continuation Data"
"274","0.340347","192.168.10.26","108.160.173.162","TCP","54","51074 > 443 [ACK] Seq=1 Ack=30661 Win=16560 Len=0"
"275","0.341895","108.160.173.162","192.168.10.26","SSL","1514","Continuation Data"
"276","0.343819","54.230.6.15","192.168.10.26","SSLv2","1514","Encrypted Data"
"277","0.343892","192.168.10.26","54.230.6.15","TCP","54","51063 > 443 [ACK] Seq=1 Ack=146001 Win=43800 Len=0"
"278","0.346833","54.230.6.15","192.168.10.26","TCP","1514","[TCP segment of a reassembled PDU]"
"279","0.347810","54.230.6.15","192.168.10.26","TCP","1514","[TCP segment of a reassembled PDU]"
"280","0.347866","192.168.10.26","54.230.6.15","TCP","54","51063 > 443 [ACK] Seq=1 Ack=148921 Win=43435 Len=0"
"281","0.351581","54.230.6.15","192.168.10.26","SSLv2","1514","Encrypted Data"
"282","0.353627","54.230.6.15","192.168.10.26","TCP","1514","[TCP segment of a reassembled PDU]"
"283","0.353818","192.168.10.26","54.230.6.15","TCP","54","51063 > 443 [ACK] Seq=1 Ack=151841 Win=45990 Len=0"
"284","0.355086","54.230.6.15","192.168.10.26","TCP","1514","[TCP segment of a reassembled PDU]"
"285","0.357645","54.230.6.15","192.168.10.26","SSLv2","1514","Encrypted Data"
"286","0.357840","192.168.10.26","54.230.6.15","TCP","54","51063 > 443 [ACK] Seq=1 Ack=154761 Win=45260 Len=0"
"287","0.360771","54.230.6.15","192.168.10.26","TCP","1514","[TCP segment of a reassembled PDU]"
"288","0.362079","54.230.6.15","192.168.10.26","TCP","1514","[TCP segment of a reassembled PDU]"
"289","0.362151","192.168.10.26","54.230.6.15","TCP","54","51063 > 443 [ACK] Seq=1 Ack=157681 Win=44895 Len=0"
"290","0.364889","54.230.6.15","192.168.10.26","TCP","1514","[TCP segment of a reassembled PDU]"
"291","0.367640","108.160.173.162","192.168.10.26","SSL","1514","Continuation Data"
"292","0.367814","192.168.10.26","108.160.173.162","TCP","54","51074 > 443 [ACK] Seq=1 Ack=33581 Win=16560 Len=0"
"293","0.369836","108.160.173.162","192.168.10.26","SSL","1514","Continuation Data"
"294","0.371646","54.230.6.15","192.168.10.26","SSLv2","1514","Encrypted Data"
"295","0.371747","192.168.10.26","54.230.6.15","TCP","54","51063 > 443 [ACK] Seq=1 Ack=160601 Win=44165 Len=0"
"296","0.374174","54.230.6.15","192.168.10.26","TCP","1514","[TCP segment of a reassembled PDU]"
"297","0.375579","54.230.6.15","192.168.10.26","TCP","1514","[TCP segment of a reassembled PDU]"
"298","0.375651","192.168.10.26","54.230.6.15","TCP","54","51063 > 443 [ACK] Seq=1 Ack=163521 Win=43435 Len=0"
"299","0.378687","54.230.6.15","192.168.10.26","TCP","1514","[TCP segment of a reassembled PDU]"
"300","0.380542","54.230.6.15","192.168.10.26","TCP","1514","[TCP segment of a reassembled PDU]"
"301","0.380623","192.168.10.26","54.230.6.15","TCP","54","51063 > 443 [ACK] Seq=1 Ack=166441 Win=43070 Len=0"
"302","0.382650","108.160.173.162","192.168.10.26","SSL","1514","Continuation Data"
"303","0.382696","192.168.10.26","108.160.173.162","TCP","54","51072 > 443 [ACK] Seq=1 Ack=23361 Win=16560 Len=0"
"304","0.384643","54.230.6.15","192.168.10.26","TCP","1514","[TCP segment of a reassembled PDU]"
"305","0.388112","54.230.6.15","192.168.10.26","TCP","1514","[TCP segment of a reassembled PDU]"
"306","0.388242","192.168.10.26","54.230.6.15","TCP","54","51063 > 443 [ACK] Seq=1 Ack=169361 Win=42340 Len=0"
"307","0.390645","54.230.6.15","192.168.10.26","TCP","1514","[TCP segment of a reassembled PDU]"
"308","0.392341","54.230.6.15","192.168.10.26","TCP","1514","[TCP segment of a reassembled PDU]"
"309","0.392422","192.168.10.26","54.230.6.15","TCP","54","51063 > 443 [ACK] Seq=1 Ack=172281 Win=41975 Len=0"
"310","0.393922","54.230.6.15","192.168.10.26","TCP","1514","[TCP segment of a reassembled PDU]"
"311","0.400015","54.230.6.15","192.168.10.26","TCP","1514","[TCP segment of a reassembled PDU]"
"312","0.400141","192.168.10.26","54.230.6.15","TCP","54","51063 > 443 [ACK] Seq=1 Ack=175201 Win=41245 Len=0"
"313","0.400372","54.230.6.15","192.168.10.26","TCP","1514","[TCP segment of a reassembled PDU]"
"314","0.400802","54.230.6.15","192.168.10.26","TCP","1514","[TCP segment of a reassembled PDU]"
"315","0.400839","192.168.10.26","54.230.6.15","TCP","54","51063 > 443 [ACK] Seq=1 Ack=178121 Win=41245 Len=0"
"316","0.404102","54.230.6.15","192.168.10.26","TCP","1514","[TCP segment of a reassembled PDU]"
"317","0.405931","54.230.6.15","192.168.10.26","TCP","1514","[TCP segment of a reassembled PDU]"
"318","0.405972","192.168.10.26","54.230.6.15","TCP","54","51063 > 443 [ACK] Seq=1 Ack=181041 Win=48545 Len=0"
"319","0.408184","54.230.6.15","192.168.10.26","TCP","1514","[TCP segment of a reassembled PDU]"
"320","0.410534","54.230.6.15","192.168.10.26","TCP","1514","[TCP segment of a reassembled PDU]"
"321","0.410603","192.168.10.26","54.230.6.15","TCP","54","51063 > 443 [ACK] Seq=1 Ack=183961 Win=47815 Len=0"
"322","0.413701","54.230.6.15","192.168.10.26","TCP","1514","[TCP segment of a reassembled PDU]"
"323","0.415656","54.230.6.15","192.168.10.26","SSLv2","1514","Encrypted Data"
"324","0.415793","192.168.10.26","54.230.6.15","TCP","54","51063 > 443 [ACK] Seq=1 Ack=186881 Win=47085 Len=0"
"325","0.417765","54.230.6.15","192.168.10.26","TCP","1514","[TCP segment of a reassembled PDU]"
"326","0.420637","108.160.173.162","192.168.10.26","SSL","1514","Continuation Data"
"327","0.422849","108.160.173.162","192.168.10.26","SSL","1514","Continuation Data"
"328","0.422921","192.168.10.26","108.160.173.162","TCP","54","51073 > 443 [ACK] Seq=1 Ack=8761 Win=65520 Len=0"
"329","0.424760","54.230.6.15","192.168.10.26","TCP","1514","[TCP segment of a reassembled PDU]"
"330","0.424906","192.168.10.26","54.230.6.15","TCP","54","51063 > 443 [ACK] Seq=1 Ack=189801 Win=46355 Len=0"
"331","0.427638","54.230.6.15","192.168.10.26","TCP","1514","[TCP segment of a reassembled PDU]"
"332","0.430092","54.230.6.15","192.168.10.26","TCP","1514","[TCP segment of a reassembled PDU]"
"333","0.430172","192.168.10.26","54.230.6.15","TCP","54","51063 > 443 [ACK] Seq=1 Ack=192721 Win=45625 Len=0"
"334","0.430623","54.230.6.15","192.168.10.26","TCP","1514","[TCP segment of a reassembled PDU]"
"335","0.439234","54.230.6.15","192.168.10.26","TCP","1514","[TCP segment of a reassembled PDU]"
"336","0.439308","192.168.10.26","54.230.6.15","TCP","54","51063 > 443 [ACK] Seq=1 Ack=195641 Win=48180 Len=0"
"337","0.440095","54.230.6.15","192.168.10.26","TCP","1514","[TCP segment of a reassembled PDU]"
"338","0.440237","54.230.6.15","192.168.10.26","TCP","1514","[TCP segment of a reassembled PDU]"
"339","0.440268","192.168.10.26","54.230.6.15","TCP","54","51063 > 443 [ACK] Seq=1 Ack=198561 Win=47815 Len=0"
"340","0.440474","54.230.6.15","192.168.10.26","TCP","1514","[TCP segment of a reassembled PDU]"
"341","0.443624","54.230.6.15","192.168.10.26","TCP","1514","[TCP segment of a reassembled PDU]"
"342","0.443758","192.168.10.26","54.230.6.15","TCP","54","51063 > 443 [ACK] Seq=1 Ack=201481 Win=48180 Len=0"
"343","0.445891","54.230.6.15","192.168.10.26","TCP","1514","[TCP segment of a reassembled PDU]"
"344","0.447622","54.230.6.15","192.168.10.26","TCP","1514","[TCP segment of a reassembled PDU]"
"345","0.447726","192.168.10.26","54.230.6.15","TCP","54","51063 > 443 [ACK] Seq=1 Ack=204401 Win=47450 Len=0"
"346","0.450846","54.230.6.15","192.168.10.26","TCP","1514","[TCP segment of a reassembled PDU]"
"347","0.452611","54.230.6.15","192.168.10.26","TCP","1514","[TCP segment of a reassembled PDU]"
"348","0.452803","192.168.10.26","54.230.6.15","TCP","54","51063 > 443 [ACK] Seq=1 Ack=207321 Win=46720 Len=0"
"349","0.454831","54.230.6.15","192.168.10.26","SSLv2","1514","Encrypted Data"
"350","0.457592","54.230.6.15","192.168.10.26","TCP","1514","[TCP segment of a reassembled PDU]"
"351","0.457776","192.168.10.26","54.230.6.15","TCP","54","51063 > 443 [ACK] Seq=1 Ack=210241 Win=45990 Len=0"
"352","0.458325","54.230.6.15","192.168.10.26","SSLv2","1514","Encrypted Data"
"353","0.461852","108.160.173.162","192.168.10.26","SSL","1514","Continuation Data"
"354","0.461943","192.168.10.26","108.160.173.162","TCP","54","51071 > 443 [ACK] Seq=1 Ack=23361 Win=16560 Len=0"
"355","0.463243","108.160.173.162","192.168.10.26","SSL","1514","Continuation Data"
"356","0.465201","108.160.173.162","192.168.10.26","SSL","1514","Continuation Data"
"357","0.465329","192.168.10.26","108.160.173.162","TCP","54","51074 > 443 [ACK] Seq=1 Ack=36501 Win=16560 Len=0"
"358","0.468295","108.160.173.162","192.168.10.26","SSL","1514","Continuation Data"
"359","0.470391","108.160.173.162","192.168.10.26","SSL","1514","Continuation Data"
"360","0.470485","192.168.10.26","108.160.173.162","TCP","54","51074 > 443 [ACK] Seq=1 Ack=39421 Win=16560 Len=0"
"361","0.473816","108.160.173.162","192.168.10.26","SSL","1514","Continuation Data"
"362","0.474907","54.230.6.15","192.168.10.26","TCP","1514","[TCP segment of a reassembled PDU]"
"363","0.474984","192.168.10.26","54.230.6.15","TCP","54","51063 > 443 [ACK] Seq=1 Ack=213161 Win=45260 Len=0"
"364","0.477757","54.230.6.15","192.168.10.26","TCP","1514","[TCP segment of a reassembled PDU]"
"365","0.480288","54.230.6.15","192.168.10.26","TCP","1514","[TCP segment of a reassembled PDU]"
"366","0.480388","192.168.10.26","54.230.6.15","TCP","54","51063 > 443 [ACK] Seq=1 Ack=216081 Win=44530 Len=0"
"367","0.483225","54.230.6.15","192.168.10.26","SSLv2","1514","Encrypted Data"
"368","0.483462","54.230.6.15","192.168.10.26","TCP","1514","[TCP segment of a reassembled PDU]"
"369","0.483513","192.168.10.26","54.230.6.15","TCP","54","51063 > 443 [ACK] Seq=1 Ack=219001 Win=43800 Len=0"
"370","0.486944","54.230.6.15","192.168.10.26","TCP","1514","[TCP segment of a reassembled PDU]"
"371","0.490721","54.230.6.15","192.168.10.26","TCP","1514","[TCP segment of a reassembled PDU]"
"372","0.490796","192.168.10.26","54.230.6.15","TCP","54","51063 > 443 [ACK] Seq=1 Ack=221921 Win=46720 Len=0"
"373","0.491356","54.230.6.15","192.168.10.26","TCP","1514","[TCP segment of a reassembled PDU]"
"374","0.493143","54.230.6.15","192.168.10.26","TCP","1514","[TCP segment of a reassembled PDU]"
